﻿book_id,title,author,pub_date,description,category,cover
9791198873347,"금붕어의 철학 - 알튀세르, 푸코, 버틀러와 함께 어항에서 빠져나오기",배세진 (지은이),2025-04-19,"현대 프랑스철학 중에서도 가장 논쟁적이고 급진적인 흐름인 포스트-구조주의를 다룬다. 루이 알튀세르, 미셸 푸코, 주디스 버틀러를 중심으로 설명을 전개하지만, 개별 사상가들의 생애랄지 핵심 개념들에 대한 정의랄지를 나열하며 제시하지는 않는다.",국내도서>인문학>서양철학>서양철학 일반,https://image.aladin.co.kr/product/36242/65/coversum/k742038810_1.jpg
9791190776752,만화로 보는 3분 철학 1 : 서양 고대 철학편,"김재훈, 서정욱 (지은이)",2021-07-02,"인문학과 철학의 중요성이 강조되는 시대지만 정작 어디부터 공부하면 좋을지 몰라 막막해하는 사람들을 위한 책, 『만화로 보는 3분 철학』이 카시오페아에서 출간되었다.",국내도서>인문학>철학 일반>교양 철학,https://image.aladin.co.kr/product/27434/96/coversum/k092733374_1.jpg
9791192488585,센스의 철학 - 예술과 일상을 대하는 세련된 감각,"지바 마사야 (지은이), 전경아 (옮긴이), 김정운 (추천)",2025-03-14,일본에서 출간되자마자 인문 분야를 석권했을 뿐 아니라 도쿄대·교토대 학생들이 가장 애독하며 숱한 화제를 뿌렸던 이 책은 한마디로 ‘센스란 이런 것이다’라는 하나의 견해를 설득력 있게 제시한다. 독자들은 대중적 철학과 인문 기반의 이 친절하고 재미있는 설명에 열광할 수밖에 없을 것이다.,국내도서>인문학>서양철학>미학/예술철학,https://image.aladin.co.kr/product/35942/61/coversum/k002037706_1.jpg
9791198632517,"21세기를 살아가는 현대인을 위한 철학 - 생각을 리부트하라, AI 시대 인생 철학법","토마스 아키나리 (지은이), 장하나 (옮긴이)",2025-03-20,복잡하고 불확실한 시대를 살아가는 현대인들이 마주하는 지극히 현실적인 고민에 철학자들은 어떤 대답을 내놓을까? 이 궁금증에서 출발한 책은 철학을 어렵고 자신과 거리가 먼 학문으로 느끼는 사람들에게 색다른 접근법을 제시한다.,국내도서>자기계발>성공>성공학,https://image.aladin.co.kr/product/35873/94/coversum/k892037781_1.jpg
9788934971351,철학은 날씨를 바꾼다,서동욱 (지은이),2024-01-12,"국내 최고의 들뢰즈 사상 연구자이자 시인과 평론가로 활동해온 서강대학교 철학과 서동욱 교수가 7년 만에 출간한 에세이. 연결될수록 고립되는 세계, 버틸수록 소진되는 일상에 던지는 철학의 위로는 “삶에서 어디에 햇살이 깃들고 어디에 반가운 여름비가 오는지” 찾아준다. 우리는 한 사람의 마음을 어루만지고 모든 변화의 출발점이 되는 생각, 날씨를 선물해주는 생각의 힘을 체험하게 될 것이다.",국내도서>인문학>교양 인문학,https://image.aladin.co.kr/product/33148/4/coversum/8934971355_1.jpg
9791193866146,철학의 쓸모,"로랑스 드빌레르 (지은이), 박효은 (옮긴이)",2024-08-20,"출간 후 40주 연속 베스트셀러, 2023년 최고의 책 등 대한민국에 ‘바다’ 열풍을 불러일으켰던 《모든 삶은 흐른다》의 저자 로랑스 드빌레르가 이번에는 철학 그 자체의 힘과 쓸모에 대해서 이야기한다.",국내도서>인문학>교양 인문학,https://image.aladin.co.kr/product/34469/47/coversum/k192932533_1.jpg
9791168270015,만화로 보는 3분 철학 2 : 서양 중세·근대 철학편,"김재훈, 서정욱 (지은이)",2021-10-27,지금까지 이런 철학 만화는 없었다! 철학의 기초 개념을 잡는 가장 쉬운 책이다. 만화로 3분이면 완벽하게 개념 잡는 서양철학사를 담았다.,국내도서>인문학>철학 일반>교양 철학,https://image.aladin.co.kr/product/28209/91/coversum/k092835178_1.jpg
9791168270343,만화로 보는 3분 철학 3 : 서양 현대 철학편,"김재훈, 서정욱 (지은이)",2022-05-09,지금까지 이런 철학 만화는 없었다! 철학의 기초 개념을 잡는 가장 쉬운 책이다. 만화로 3분이면 완벽하게 개념 잡는 서양철학사.,국내도서>인문학>철학 일반>교양 철학,https://image.aladin.co.kr/product/29398/47/coversum/k332837618_1.jpg
9791130620459,철학은 어떻게 삶의 무기가 되는가 (리커버) - 불확실한 삶을 돌파하는 50가지 생각 도구,"야마구치 슈 (지은이), 김윤경 (옮긴이)",2019-01-22,"2019년 출간 즉시 종합 베스트셀러 1위에 오르며 ‘철학 신드롬’을 일으킨 『철학은 어떻게 삶의 무기가 되는가』가 리커버로 새롭게 출간되었다. 주요 언론사가 강력 추천하며 ‘우리 시대의 인문 고전’에 등극한 이 책은, 이번 리커버를 통해 ‘지적 전투력을 높이는 생각 사전’을 시각화한 고급스러운 디자인으로 독자들을 다시 찾아간다.",국내도서>인문학>철학 일반>교양 철학,https://image.aladin.co.kr/product/34853/43/coversum/k652933840_1.jpg
9791194144076,"알고리즘으로 철학하기 - 코드 너머의 사유, 기술과 존재를 잇다",변정수 (지은이),2025-04-30,"‘알고리즘’이라는 개념을 단순히 컴퓨터과학의 기술적 도구로 보는 것이 아니라 인류가 살아가면서 직면하는 철학적 질문에 접근하는 새로운 방식으로 소개한다. 저자는 알고리즘이 어떻게 인간의 사고방식을 바꾸고, 우리가 진리나 자유, 존재에 대해 어떤 방식으로 이해하게 만드는지를 묻는다.",국내도서>인문학>철학 일반>교양 철학,https://image.aladin.co.kr/product/36236/21/coversum/k672038607_1.jpg
9788961474726,들뢰즈의 영화철학 - 『시네마』를 넘어서,이지영 (지은이),2025-02-28,"&lt;들뢰즈의 영화철학&gt;은 영화를 통해 새로운 사유의 가능성을 연 철학자 들뢰즈의 영화철학을 이해하고, 적용하고, 넘어서기 위한 시도를 담고 있다. 들뢰즈의 영화철학을 중심으로 영화와 인접 영상 예술을 연구해온 철학자 이지영 교수는 이 책에서 들뢰즈를 사다리로 삼아 들뢰즈의 영화철학에 기어오르고, 올라타고, 사다리를 변형시키고자 한다.",국내도서>인문학>서양철학>현대철학>질 들뢰즈/펠릭스 가타리,https://image.aladin.co.kr/product/35933/64/coversum/8961474723_1.jpg
9791163931812,철학 고양이 소피 - 동화로 읽는 철학,"차이즈친 (지은이), 마오실리우 (그림), 라미파 (옮긴이)",2025-03-31,"주인공 필로가 수상한 철학 고양이 소피와 함께 철학의 세계를 여행하며 궁금증에 대한 답을 찾아가는 이야기이다. 필로는 우리 주변에서 흔히 볼 수 있는 초등학생으로, 친구 관계를 고민하고 공부보다는 노는 걸 좋아하는 지극히 평범한 아이이다. 별다를 것 없는 필로의 일상에서 일어나는 작은 사건들이 철학 여행의 출발점이 된다.",국내도서>어린이>동화/명작/고전>외국창작동화,https://image.aladin.co.kr/product/36022/58/coversum/k042037927_1.jpg
9791168272699,"인생의 오후에는 철학이 필요하다 - 키케로부터 노자까지, 25명의 철학자들이 들려주는 삶, 나이 듦, 죽음에 관한 이야기","오가와 히토시 (지은이), 조윤주 (옮긴이)",2025-02-03,"‘지금 내가 잘 살아가고 있는 게 맞을까?’, ‘나이 드는 게 불안하고 두렵다’, ‘왜 점점 내 곁의 사람들이 떠나갈까?’, ‘나이 든 후에는 어떻게 먹고살아야 할까?’ 지금 이러한 생각들이 찾아온다면 우리에게 철학이 필요한 순간이다.",국내도서>인문학>철학 일반>교양 철학,https://image.aladin.co.kr/product/35628/26/coversum/k032036399_1.jpg
9788998075200,사업의 철학 - 성공한 사람들은 절대 말해 주지 않는 성공의 모든 것,"마이클 E. 거버 (지은이), 이제용 (옮긴이)",2015-09-01,"마이클 거버 컴퍼니의 창립자이자 CDO인 마이클 E. 거버의 책. 이 책은 미국에서 출간 즉시 경영의 고전이 된 책으로, 사업에 대해 아무것도 모른 채 무작정 창업에 뛰어들었다가 이내 지옥의 고통을 맛봐야 했던 수많은 사업가들을 폐업의 위기로부터 구한 밀리언셀러다.",국내도서>경제경영>기업 경영>경영전략/혁신,https://image.aladin.co.kr/product/6579/50/coversum/8998075202_2.jpg
9788958285342,철학이 필요한 시간 - 강신주의 인문학 카운슬링,강신주 (지은이),2011-02-15,"“나는 왜 이러고 살지?”의 주인공들을 위한 인문 공감 에세이. 지금은 자기 위로와 자기 최면이 아닌 아파도 당당하게 상처를 마주할 수 있게 하는 인문학이 필요하다. 이 책은 니체, 스피노자, 원효, 데리다 등 철학자들의 인문 고전을 통해 고민과 불안에 갇혀 있는 이들에게 솔직하게 삶에 직면하고 상처를 치유할 수 있는 방법을 제시한다.",국내도서>인문학>교양 인문학,https://image.aladin.co.kr/product/872/83/coversum/8958285346_2.jpg
9791198889553,어린이를 위한 철학자의 말 - 내 마음을 단단하게 지켜주는 빛나는 철학의 문장들,김종원 (지은이),2025-03-20,"20여 년간 100권이 넘는 책을 집필하며 120만 독자들로부터 큰 사랑을 받고 있는 인문학 커뮤니케이터, 김종원 작가가 어린이를 위한 철학 책을 출간했다. &lt;어린이를 위한 철학자의 말&gt;은 아이들이 쉽게 풀리지 않는 질문에 맞닥뜨렸을 때, 친구와 관계 맺기에 어려움을 느낄 때, 어른들의 말을 이해할 수 없어서 혼란스러울 때 철학자들의 말에서 답을 찾도록 돕는다.",국내도서>어린이>사회/역사/철학>철학,https://image.aladin.co.kr/product/36049/61/coversum/k662037048_1.jpg
9788964452967,세계사의 철학 강의 - 베를린 1822/23,"게오르그 빌헬름 프리드리히 헤겔 (지은이), 서정혁 (옮긴이)",2025-04-10,서양철학자 가운데 그 누구보다 폭넓고 다양한 문제를 심층적으로 다루고 자신만의 관점에서 체계화하려 했던 철학자가 헤겔이다. 이번에 번역자 서정혁 교수가 번역 저본으로 삼은 것은 독일 펠릭스 마이너 출판사(Felix Meiner Verlag)에서 1996년 출간한 것이다.,국내도서>인문학>서양철학>근대철학>헤겔,https://image.aladin.co.kr/product/36182/75/coversum/8964452968_1.jpg
9791189584795,철학의 숲 - 동화와 신화 속에 숨겨진 26가지 생각 씨앗을 찾아서,"브렌던 오도너휴 (지은이), 허성심 (옮긴이)",2020-08-26,십여 년간 초중학교와 대학교에서 수많은 학생을 가르친 철학 교육자인 저자는 영어와 수학 공부 이전에 ‘철학’이 먼저라고 거듭 강조한다. 실제로 여러 유럽 국가는 철학을 주요 과목으로 지정한다. 철학은 질문을 던져 ‘생각의 폭’을 넓혀주는 유일한 과목이기 때문이다.,국내도서>청소년>청소년 철학,https://image.aladin.co.kr/product/24943/89/coversum/k452632693_1.jpg
9791173321818,동서양 철학 신박한 정리 - 한 권으로 흐름을 꿰뚫는 생각의 역사,박영규 (지은이),2025-04-28,"300만 밀리언셀러 저자 박영규가 당신의 생존력을 높이는 최소한의 철학 지식 《동서양 철학 신박한 정리》를 펴냈다. 시대와 인물을 아우르는 종합적인 관점으로 동서양의 주요 사상을 정립한 철학자의 생애는 물론 꼭 알아야 할 사상의 기본 개념과 대표 저작, 등장 배경을 간단명료하고 일목요연하게 압축했다.",국내도서>인문학>철학 일반>교양 철학,https://image.aladin.co.kr/product/36263/39/coversum/k312038737_1.jpg
9788901061252,"철학카페에서 문학읽기 - 에서 까지, 철학, 세기의 문학을 읽다",김용규 (지은이),2006-11-13,"고전에 속하는 총 13편의 소설과 희곡들에 대해 독자들과 이야기를 나누는 형식으로 구성했다. 독자들이 편안한 의자에 앉아 차를 마시며 오랜 친구와 담소를 나누는 듯한 기분으로 읽을 수 있도록 했다. 작품에 대한 사소한 정보부터 교양이 될 만한 각종 주제들, 그들에 대한 철학적 해석까지 다양하게 마련했다.",국내도서>인문학>철학 일반>교양 철학,https://image.aladin.co.kr/product/85/59/coversum/8901061252_2.jpg
9791193487068,채사장의 지대넓얕 12 : 철학의 시작 - 지적 대화를 위한 넓고 얕은 지식,"채사장, 마케마케 (지은이), 정용환 (그림)",2025-01-20,2021년 출간과 동시에 아이들과 학부모 사이에서 인문학 열풍을 일으킨 &lt;채사장의 지대넓얕&gt; 시리즈. 신간이 나올 때마다 입소문을 타고 이제는 어린이 인문학 필독서로 자리 잡았다. 독자들은 단편적인 정보 습득을 넘어 세상을 보는 눈을 갖게 되었다고 입을 모아 말한다.,국내도서>어린이>사회/역사/철학>철학,https://image.aladin.co.kr/product/35478/31/coversum/k192035548_1.jpg
9791190292290,관광객의 철학 - 증보판,"아즈마 히로키 (지은이), 안천 (옮긴이)",2025-03-20,"2020년 한국어판 초판이 출간된 『관광객의 철학』의 증보판이다. 다방면에 걸쳐 이어 온 지은이의 작업을 종합하고 새로운 전개를 선언한 책에, 시간이 지나며 변화한 세계상과 다른 언어로 번역되는 과정에서 이해의 맥락을 보충한 글들이 덧대어졌다. 또 『정정 가능성의 철학』 등 후속 작업과의 연결성을 보강하는 글들을 추가해, 발전과 생성의 도상에 있는 철학자 아즈마 히로키의 대표작으로서 위상을 공고히 했다.",국내도서>인문학>철학 일반>교양 철학,https://image.aladin.co.kr/product/36028/28/coversum/k402037122_1.jpg
9791191842869,철학이 깊을수록 삶은 단순하다 - 세상에 실망할 때 나를 붙잡아 줄 선한 질문들,"레베카 라인하르트 (지은이), 장혜경 (옮긴이)",2025-04-30,"우리는 인류가 더 혼란스러운 시대도 다 지나왔음을 모르지 않는다. 다만 지금, 여기의 나침반이 절실할 뿐. 《철학이 깊을수록 삶은 단순하다》는 그리스 철학 이래, 오랜 세월 무르익은 인류의 통찰을 바탕으로 이 지난한 오늘을 버텨낼 지혜와 내공을 일깨우는 책이다.",국내도서>인문학>철학 일반>교양 철학,https://image.aladin.co.kr/product/36283/15/coversum/k152038034_1.jpg
9791193378397,열두 달 철학 상담소 - 연중무휴 고민 상담 중,이진민 (지은이),2025-03-20,"철학이 고민 해결에 무슨 쓸모가 있겠나 싶겠지만, 사실 우리가 삶에서 마주한 질문들은 철학자들이 수백 년 전부터 잠 못 이루며 탐구해 온 문제들과 크게 다르지 않다. 친구, 성적, 가족, 사랑, 진로 등 청소년들의 고민과 철학자들의 생각 사이에 다리를 놓아 주며 독자들이 정답 없는 문제를 더 깊이, 끝까지 파고들 수 있도록 이끈다.",국내도서>청소년>청소년 철학,https://image.aladin.co.kr/product/36088/95/coversum/k492038761_1.jpg
9791168272866,"탁월한 생각은 철학에서 시작된다 - 아리스토텔레스부터 들뢰즈까지, 철학자들이 들려주는 20가지 생각 도구","오가와 히토시 (지은이), 이정미 (옮긴이)",2025-03-20,"아리스토텔레스부터 들뢰즈까지, 세상을 남다르게 바라봤던 철학자들의 20가지 사고법을 빌려와 일상과 비즈니스에 적용하는 방법을 제시하는 철학교양서다.",국내도서>인문학>교양 인문학,https://image.aladin.co.kr/product/36096/98/coversum/k372038961_1.jpg
9788997780624,결국 국민이 합니다 - 이재명의 인생과 정치철학,이재명 (지은이),2025-04-15,"2024년 12월 3일 ‘내란의 밤’부터 윤석열 대통령 탄핵소추안 가결, 2025년 4월 4일 헌재의 파면 선고까지 숨가빴던 순간들의 ‘막전막후’를 이재명의 시선으로 들여다본다.",국내도서>사회과학>정치학/외교학/행정학>정치인,https://image.aladin.co.kr/product/36209/99/coversum/899778062x_1.jpg
9788934965909,더 좋은 삶을 위한 철학 - 천사와 악마 사이 더 나은 선택을 위한 안내서,"마이클 슈어 (지은이), 염지선 (옮긴이)",2023-02-24,"복잡한 선택과 함정, 거짓 멘토와 어리석은 조언들로 가득한 이 세상에서 더 나은 선택을 하려는 이들을 위한 철학의 조언. 수천 년 동안 ‘좋은 삶이란 무엇인가’를 고민해온 철학자들의 지혜를 빌려 일상 속 윤리적 딜레마가 충돌하는 순간을 유머러스하게 조명한다.",국내도서>인문학>인문 에세이,https://image.aladin.co.kr/product/31132/45/coversum/8934965908_1.jpg
9791198593283,황현필의 진보를 위한 역사 - 진짜 진보의 지침서 & 가짜 극우의 계몽서,황현필 (지은이),2025-02-07,"저자 황현필은 그동안 역사 최전방에서 이들과 싸워 왔다. 그리고 이 책을 통해 뉴라이트의 역사 왜곡을 하나하나 짚어 가며 그들의 거짓말을 잡아냈고, 진실을 알리는 작업을 완수했다.",국내도서>역사>한국사 일반,https://image.aladin.co.kr/product/35711/76/coversum/k612036127_1.jpg
9791194028451,역사 쌤과 함께하는 한국사 도장 깨기 1 - 서울(전근대),"허두영 (지은이), 김학수 (그림)",2025-04-18,"‘역사 쌤과 함께하는 한국사 도장 깨기’ 시리즈는 ‘도장 깨기’라는 콘셉트를 앞으로 내세워 역사를 지루해하거나 어려워하는 아이들에게 흥미를 돋우며, 우리 역사의 현장에 관심을 갖고 한 발짝 앞으로 나아가게 하는 데 지렛대 역할을 하려 한다.",국내도서>어린이>초등 한국사,https://image.aladin.co.kr/product/36237/47/coversum/k132038711_1.jpg
9791194383154,"그랑프리, 그림으로 보는 F1 역사","윌 벅스턴 (지은이), 윤재수 (옮긴이)",2025-04-01,"F1 레이싱의 흥미진진한 역사를 그림과 함께 다룬 책으로, 매력적인 스포츠의 기원과 챔피언십의 속사정부터 20세기와 현대 최고의 드라이버들까지 아우른다. 이 책은 유명 모터스포츠 방송인이자 〈F1, 본능의 질주〉의 스타가 집필한 작품이다.",국내도서>건강/취미>스포츠/레저 기타>기타,https://image.aladin.co.kr/product/36122/13/coversum/k822038262_2.jpg
9788964362761,역사의 시선 - 역사학자 전우용의 시대 논설,전우용 (지은이),2025-03-07,"재야의 역사학자 전우용이 ‘현재 우리’가 어디로 가야 하는지에 대해 치열하게 고민한 결과를 담은 책이다. 《역사의 시선》이 유사한 다른 책들과 차별화된 점은, 고민의 결과를 ‘역사’에서 찾았다는 것이다. ‘역사’는 모두가 다 알고 있는 내용이다. 그러므로 어디로 가야 하는지에 대한 방향을 제대로 찾을 수 있다. 즉, 역사가 보는 곳, 역사가 가리키는 곳을 따라가면 ‘현재 우리’는 ‘더 나은 미래에서 사는 우리’가 될 수 있다.",국내도서>역사>역사학>역사학 일반,https://image.aladin.co.kr/product/35890/9/coversum/8964362764_1.jpg
9791193168134,한국 재벌 흑역사 3 - 신세계 · 두산 · 대한항공 외,이완배 (지은이),2025-03-20,"『한국 재벌 흑역사』 상, 하권의 저자 &lt;민중의소리&gt; 이완배 기자가 『한국 재벌 흑역사 3』을 새롭게 선보인다. 『한국 재벌 흑역사 (하)』 이후 8년만에 출간되는 『한국 재벌 흑역사 3』은 1권과 2권에서 다루지 못했던 신세계, 두산, 대한항공 등 다른 재벌들의 어두운 역사를 상세히 기록했다.",국내도서>경제경영>기업/경영자 스토리>국내 기업/경영자,https://image.aladin.co.kr/product/35938/96/coversum/k152037705_1.jpg
9791198538116,반일 종족의 역사 내란,"이영훈, 김용삼, 주익종, 이우연 (지은이)",2025-02-24,이승만학당 이영훈 교장(전 서울대 교수) 팀이 5년만에 내놓은 ‘반일 종족’ 시리즈 제3탄. 저자들은 박근혜·윤석열 두 우익 정권 탄핵 사태의 근원을 반일 종족의 거짓말 문화에서 찾는다.,국내도서>역사>한국사 일반,https://image.aladin.co.kr/product/35834/34/coversum/k442037767_2.jpg
9791166091001,한끝 중등 역사 ②-1 (2025년용) - 2015 개정 교육과정,비상교육 편집부 (지은이),2020-10-01,,국내도서>중학교참고서>중3-문제집>사회.역사(중등3),https://image.aladin.co.kr/product/25463/47/coversum/k912633727_1.jpg
9788971998557,역사의 역사 - History of Writing History,유시민 (지은이),2018-06-25,"&lt;거꾸로 읽는 세계사&gt; 작가 유시민의 신작. 고대로부터 최근까지 역사를 사로잡은 18권의 역사서들을 9장으로 나누어 훑으며 ‘역사’라는 화두를 전개해간다. 서문과 프롤로그에서 역사 탐사의 계획을 소개한 뒤, 본문에서 각각의 역사서와 역사가들이 역사를 무엇이라 생각했는지 탐문한다.",국내도서>역사>역사학>역사학 일반,https://image.aladin.co.kr/product/14944/52/coversum/8971998555_3.jpg
9791166090998,한끝 중등 역사 ①-1 : 2015 개정 교육과정 (2025년용),비상교육 편집부 (지은이),2020-10-01,"9종 교과서의 핵심 내용을 한눈에 확인할 수 있도록 하였고, 체계적이고 단계적인 문제로 구성하였다.",국내도서>중학교참고서>중2-문제집>사회.역사(중등2),https://image.aladin.co.kr/product/25463/61/coversum/k112633727_1.jpg
9791193168110,한국 재벌 흑역사 1 - 삼성·현대,이완배 (지은이),2025-03-20,"2015년 첫 출간됐던 『한국 재벌 흑역사 (상)』이 『한국 재벌 흑역사 1』로 재출간된다. 한국 현대사에는 재벌들의 어두운 역사가 제대로 기록돼 있지 않다. 재벌들은 자신의 성과를 과대 포장하는 데 혈안이 돼 있고, 그들이 남긴 어두운 역사는 점차 기록에서 사라진다.",국내도서>경제경영>기업/경영자 스토리>국내 기업/경영자,https://image.aladin.co.kr/product/35938/73/coversum/k742037704_1.jpg
9791198889614,빨간내복야코 역사 속 잼민이 VS 잼민이 2 : 알렉산드로스 대왕,"빨간내복야코 (원작), 야코, 하몽 (글), 식혜 (그림), 강대진 (감수)",2025-02-19,"초등학생 사동이는 어린 잔 다르크와 힘을 합쳐 인간의 역사를 망가뜨리고, 변형된 Y에너지를 모아 야야족의 미래를 망치려던 악당의 계획을 막아냈다. 하지만 악당은 여전히 새로운 계획을 꾸미고 있다. 더 놀라운 것은, 그 악당이 바로 사동이와 똑같이 생긴 도플갱어라는 사실! 도대체 이 악당은 누구이며, 왜 이런 일을 벌이는 걸까?",국내도서>어린이>사회/역사/철학>세계사,https://image.aladin.co.kr/product/35840/14/coversum/k742037865_1.jpg
9791193168127,한국 재벌 흑역사 2 - 롯데·SK,이완배 (지은이),2025-03-20,2018년 첫 출간됐던 『한국 재벌 흑역사 (하)』가 『한국 재벌 흑역사 2』로 재출간된다. 삼성과 현대 두 가문의 어두운 역사를 적나라하게 밝혔던 『한국 재벌 흑역사 1』에 이어 SK와 롯데를 다룬 『한국 재벌 흑역사 2』는 출간 당시 독자들로부터 큰 사랑을 받았다. 출판사 사정으로 절판됐다가 『한국 재벌 흑역사 3』의 출간을 계기로 7년만에 복간됐다.,국내도서>경제경영>기업/경영자 스토리>국내 기업/경영자,https://image.aladin.co.kr/product/35938/94/coversum/k022037705_1.jpg
9791194273189,"무굴 제국의 역사 - 인도를 지배한 마지막 거대 제국! 황금과 피로 쓴 제국의 역사, 세계를 압도한 찬란한 문명의 절정","마이클 피셔 (지은이), 최하늘 (옮긴이), 이옥순 (감수)",2025-04-25,"오늘날 세계는 인도를 주목하고 있다. 세계 인구 1위, 빠르게 성장하는 주요 경제국 중 하나, 세계 최대의 민주주의 국가이자 미국과 중국 사이에서 전략적 균형을 이루는 외교 강국. 국제 안보와 경제 질서 재편의 중심에 인도가 있다. 그렇다면, 이 눈부신 도약의 뿌리는 어디에 있는가? 그 해답은 무굴 제국에 있다.",국내도서>역사>아시아사>인도사,https://image.aladin.co.kr/product/36257/49/coversum/k462038623_1.jpg
9791191859379,인생의 역사 - '공무도하가'에서 '사랑의 발명'까지,신형철 (지은이),2022-10-31,"우리 문학을 향한 '정확한 사랑'이자 시대를 읽는 탁월한 문장, 평론가 신형철이 4년 만의 신작으로 돌아왔다. &lt;인생의 역사&gt;라 이름한 이번 책을 두고 '시화(詩話)'라 묶었으니, 한 편의 시를 읽고 시를 나누는 이야기, 그리하여 시에서 인생을 배우고 인생을 시로 이루는 글이다.",국내도서>에세이>명사에세이>기타 명사에세이,https://image.aladin.co.kr/product/30328/61/coversum/k362839230_1.jpg
