﻿book_id,title,author,pub_date,description,category,cover
9788932043531,소설 보다 : 봄 2025,"강보라, 성해나, 윤단 (지은이)",2025-03-14,"독자에게 늘 기대 이상의 가치를 전하는 특별 기획, 『소설 보다 : 봄 2025』이 출간되었다. 『소설 보다 : 봄 2025』에는 2025년 봄 ‘이 계절의 소설’ 선정작인 강보라의 「바우어의 정원」, 성해나의 「스무드」, 윤단의 「남은 여름」 총 세 편과 작가 인터뷰가 실렸다.",국내도서>소설/시/희곡>한국소설>2000년대 이후 한국소설,https://image.aladin.co.kr/product/36071/17/coversum/8932043531_1.jpg
9788954790895,EBS 수능특강 연계 기출 문학작품 연계 기출2 고전 산문·현대 소설 (2025년) - 2026학년도 수능 대비,EBS(한국교육방송공사) 편집부 (지은이),2025-02-03,『수능특강 문학』에 수록된 지문과 연관성이 있는 기출 문항을 풀어 봄으로써 연계교재에서 출제되지 않은 나머지 문항도 대비 가능한 교재다. 수능특강 수록 작품과 수록 작가의 또 다른 작품을 다른 기출문제를 수록하였다. 신뢰도 있는 기출 문항을 수록하여 연계와 비연계를 동시에 대비할 수 있다.,국내도서>고등학교참고서>수능모의고사/기출>국어영역,https://image.aladin.co.kr/product/35765/88/coversum/8954790895_1.jpg
9791197221989,"첫 여름, 완주",김금희 (지은이),2025-05-08,세심한 온정의 세계를 빚어내는 우리 시대의 작가 김금희의 장편소설. 돈을 갚지 않고 사라진 선배 고수미의 고향 완주 마을을 찾은 성우 손열매는 그곳에서 합동 장의사 겸 매점을 운영하는 수미 어머니의 집에 머물게 된다. 오갈 데 없는 처지에 목소리에까지 이상이 생긴 열매는 수미 어머니의 매점을 지키며 각양각색의 동네 사람들을 만난다.,국내도서>소설/시/희곡>한국소설>2000년대 이후 한국소설,https://image.aladin.co.kr/product/36275/58/coversum/k692038832_2.jpg
9788965820475,"한국단편소설 40 - 중고생이 꼭 읽어야 할, ‘인물 관계도’ 수록, 개정증보판","계용묵, 김동인, 김유정, 나도향, 염상섭, 이태준, 주요섭, 채만식, 최서해, 현진건, 전영택 (지은이), 성낙수, 박찬영, 김형주 (엮은이)",2018-07-16,"중고등학교 교과서와 교육 과정에 꼭 포함되는 필독 작품을 선정했고, 수능·논술·내신을 위해 충실한 작품 해설을 실었다. 한 권에 가장 많은 40편의 작품을 수록하면서도 전문을 실어 완전한 감상을 할 수 있도록 했다.",국내도서>청소년>논술참고도서,https://image.aladin.co.kr/product/15644/52/coversum/8965820472_3.jpg
9791197325892,음악소설집 音樂小說集,"김애란, 김연수, 윤성희, 은희경, 편혜영 (지은이)",2024-06-13,"음악 전문 출판사 ‘프란츠’가 선보이는 첫 소설 앤솔러지 『음악소설집音樂小說集』. 한국문학을 대표하는 다섯 소설가인 김애란, 김연수, 윤성희, 은희경, 편혜영의 음악을 테마로 한 신작 단편소설이 실렸다. 일상에서 마주치는 다채로운 음악의 장면들을 섬세하게 포착한 다섯 개의 이야기를 통해, 삶의 어떤 순간이라도 음악이 될 수 있다는 것을 깨닫게 한다.",국내도서>소설/시/희곡>한국소설>2000년대 이후 한국소설,https://image.aladin.co.kr/product/34130/64/coversum/k222931917_2.jpg
9788932924939,소설을 쓸 때 내가 생각하는 것들 - 셰익스피어 앤드 컴퍼니 인터뷰집,"애덤 바일스 (지은이), 정혜윤 (옮긴이)",2025-02-10,당대 거장 작가들이 모여들었던 주요한 장소이자 문학과 예술을 사랑하는 이들에게 문화적인 상징으로 자리 잡은 파리의 서점 〈셰익스피어 앤드 컴퍼니〉. 『소설을 쓸 때 내가 생각하는 것들』은 2012년부터 2022년까지 바로 그 셰익스피어 앤드 컴퍼니에서 10년간 진행되었던 작가와의 대화 중 최고의 인터뷰를 엄선한 대담집이다.,국내도서>에세이>외국에세이,https://image.aladin.co.kr/product/35767/25/coversum/8932924937_1.jpg
9788936434595,채식주의자 (리마스터판) - 2024 노벨문학상 수상작가,한강 (지은이),2022-03-28,2016년 인터내셔널 부커상을 수상하며 한국문학의 입지를 한단계 확장시킨 한강의 장편소설. 상처받은 영혼의 고통과 식물적 상상력의 강렬한 결합을 정교한 구성과 흡인력 있는 문체로 보여주며 섬뜩한 아름다움의 미학을 한강만의 방식으로 완성한 역작이다.,국내도서>소설/시/희곡>한국소설>2000년대 이후 한국소설,https://image.aladin.co.kr/product/29137/2/coversum/8936434594_2.jpg
9788936434120,소년이 온다 - 2024 노벨문학상 수상작가,한강 (지은이),2014-05-19,섬세한 감수성과 치밀한 문장으로 인간 존재의 본질을 탐구해온 작가 한강의 여섯번째 장편소설. '상처의 구조에 대한 투시와 천착의 서사'를 통해 한강만이 풀어낼 수 있는 방식으로 1980년 5월을 새롭게 조명한다.,국내도서>소설/시/희곡>한국소설>2000년대 이후 한국소설,https://image.aladin.co.kr/product/4086/97/coversum/8936434128_2.jpg
9788954682152,"작별하지 않는다 - 2024 노벨문학상 수상작가, 한강 장편소설",한강 (지은이),2021-09-09,2016년 &lt;채식주의자&gt;로 인터내셔널 부커상을 수상하고 2018년 &lt;흰&gt;으로 같은 상 최종 후보에 오른 한강 작가의 5년 만의 장편소설. 2019년 겨울부터 이듬해 봄까지 계간 &lt;문학동네&gt;에 전반부를 연재하며 큰 관심을 모은 작품이다.,국내도서>소설/시/희곡>한국소설>2000년대 이후 한국소설,https://image.aladin.co.kr/product/27877/5/coversum/8954682154_3.jpg
9791130822211,2025 올해의 문제소설 - 현대문학 교수 350명이 뽑은,한국현대소설학회 (엮은이),2025-02-20,2024년 한 해 동안 문예지에 발표된 중·단편소설 중 한국현대소설학회에서 선정한 11편의 작품을 수록한 『2025 올해의 문제소설』이 푸른사상사에서 출간되었다. 다양한 서사 문법과 편폭을 통해 새로운 시장을 만들어가는 작가들의 새로운 문학적 감각과 세대적 감수성을 만나볼 수 있다.,국내도서>소설/시/희곡>한국소설>2000년대 이후 한국소설,https://image.aladin.co.kr/product/35766/88/coversum/k712036745_1.jpg
9791171717354,아빠 소설,이연숙 (지은이),2025-03-19,“하지만 세상에는 ‘아버지의 어딘가 좀 망가진 자식’도 있는 법이다” 상처 입고 망가져도 다시 한번 ‘진격’하는 닉네임 ‘리타’ 이연숙 첫 소설!,국내도서>소설/시/희곡>한국소설>2000년대 이후 한국소설,https://image.aladin.co.kr/product/36079/33/coversum/k302037246_1.jpg
9791190749879,"북마녀의 웹소설 프로듀싱 아카데미 - 신인 작가, 신입 PD를 위한 출판 시스템 완벽 공략집",북마녀 (지은이),2025-03-13,"웹소설 PD와 작가 지망생, 웹소설 출판사를 창업하고자 하는 이들을 위해 웹소설 출판 시스템을 완벽하게 정리했다. 독자, 플랫폼, 장르 등 웹소설 시장의 중요한 특성과 웹소설 PD의 실무를 단계별로 상세히 소개하고 ‘책 속 부록’에서 웹소설 부서 세팅하는 법을 알려준다.",국내도서>인문학>책읽기/글쓰기>글쓰기,https://image.aladin.co.kr/product/35996/67/coversum/k592037720_1.jpg
9788965823148,한국단편소설 50 - 중고생이 꼭 읽어야 할,"김동인 (지은이), 성낙수, 박찬영, 김형주 (엮은이)",2021-10-01,"중고등학교 교과서와 교육 과정에 꼭 포함되는 필독 작품을 선정했고, 수능·논술·내신을 위해 충실한 작품 해설을 실었다. 한 권에 가장 많은 50편의 작품을 수록하면서도 전문을 실어 완전한 감상을 할 수 있도록 했다.",국내도서>청소년>논술참고도서,https://image.aladin.co.kr/product/28039/72/coversum/8965823145_1.jpg
9791198948731,블랙북,김하연 (지은이),2025-04-10,"반 아이들과 함께 도서관 책 정리를 하던 날. 자발적으로 그 어떤 청소 모둠에도 끼지 않은 중3 재승은 우연히 창고에서 타지도, 젖지도, 찢어지지도 않는 책 한 권을 발견한다. 표지는 물론 오늘 날짜가 쓰인 페이지만 하얀색이고 나머지 페이지들은 모두 검은색인 독특한 책. 알고 보니 이 책에는 내일 일어날 일을 미리 알려 주는 기이한 힘이 있었고, 재승은 이에 ‘블랙북’이라는 이름을 붙여 준다.",국내도서>청소년>청소년 문학>청소년 소설,https://image.aladin.co.kr/product/36161/82/coversum/k552038889_1.jpg
9791141601713,"흰 - 2024 노벨문학상 수상작가, 한강 소설",한강 (지은이),2025-03-31,"태어난 지 두 시간 만에 세상을 떠난, 얼굴도 모르는 자신의 언니와 첫 딸을 홀로 낳고 잃은 젊었던 어머니에 대한 기억이 작가에게 있었다. “솜사탕처럼 깨끗하기만 한 ‘하얀’과 달리 ‘흰’에는 삶과 죽음이 소슬하게 함께 배어 있다. 내가 쓰고 싶은 것은 ‘흰’ 책이었다. 그 책의 시작은 내 어머니가 낳은 첫 아기의 기억이어야 할 거라고, 그렇게 걷던 어느 날 생각했다”는 작가는 그 기억에서 시작해 총 65개의 이야기를 『흰』에 담았다.",국내도서>소설/시/희곡>한국소설>2000년대 이후 한국소설,https://image.aladin.co.kr/product/36099/46/coversum/k252038964_2.jpg
9788925568584,작은 아씨들 (영화 공식 원작 소설·오리지널 커버),"루이자 메이 올콧 (지은이), 강미경 (옮긴이)",2020-02-12,그레타 거윅 감독의 영화 &lt;작은 아씨들&gt; 속 ‘조의 책’을 그대로 재현한 오리지널 커버 특별판. 각자 다른 꿈을 꾸며 자신의 삶을 주체적으로 꾸려가면서도 따스한 가족의 사랑을 전하는 네 자매의 이야기는 여성들에게 사회적 제약이 심하던 그 시절부터 여성들에게 도전을 꿈꾸게 했다.,국내도서>소설/시/희곡>영미소설,https://image.aladin.co.kr/product/22899/50/coversum/8925568586_3.jpg
9791189228361,땀 흘리는 소설,"김혜진, 김세희, 김애란, 서유미, 구병모, 김재영, 윤고은, 장강명 (지은이), 김동현, 김선산, 김형태, 이혜연 (엮은이)",2019-03-01,"현직 교사들이 사회에 첫발을 내딛을 제자들을 걱정하며, 앞으로의 사회생활에 지표가 되어 줄 8편의 소설을 가려 엮은 책. 책에는 동시대 청년들의 애환을 섬세하게 그려 내고 있는 작가 8명의 단편 소설이 실려 있다.",국내도서>소설/시/희곡>한국소설>2000년대 이후 한국소설,https://image.aladin.co.kr/product/18570/39/coversum/k002635860_1.jpg
9788965823582,한국고전소설 45 - 중고생이 꼭 읽어야 할,"박지원 (지은이), 권정현, 김형주 (엮은이)",2022-12-15,"쉽고 재미있는 고전 문학 공부를 위해 다양한 장치를 활용했다. 어려운 어휘는 바로 옆에서 풀이했고, 본문 중간중간 주석을 달아 작품을 쉽게 이해할 수 있도록 구성했다. 수능·논술·내신을 위해서 ‘작품 길잡이’, ‘구성과 줄거리’, ‘생각해 볼까요?’ 등으로 작품을 상세히 분석했다.",국내도서>청소년>논술참고도서,https://image.aladin.co.kr/product/30709/65/coversum/8965823587_1.jpg
9791139224696,소설 답 - 빛의 시크릿 심화편,소울디 (지은이),2025-03-17,지구의 인간체험을 선택했던 한 영혼이 지구별에서 깨어나는 과정을 통해 얻게 된 모든 답들을 정리한 보고서. 이 책을 통해 인간 안에 갇힌 지친 영혼들의 무거운 에너지가 정화되고 자신 안의 신성과 권능이 살아나 창조의 기쁨을 누리는 상태를 회복하는 데 도움이 되길 바란다,국내도서>자기계발>힐링>마음 다스리기,https://image.aladin.co.kr/product/36050/34/coversum/k572037040_1.jpg
9788932043395,소설 보다 : 겨울 2024,"성혜령, 이주혜, 이희주 (지은이)",2024-12-09,"2024년 겨울 ‘이 계절의 소설’ 선정작인 성혜령의 「운석」, 이주혜의 「여름 손님입니까」, 이희주의 「최애의 아이」 총 세 편과 작가 인터뷰가 실렸다. 해당 작품은 제14회 문지문학상 후보에 포함되었다. 선정위원(강동호, 소유정, 이소, 이희우, 조연정, 홍성희)의 자유로운 토론을 거쳐 선정한 작품들의 심사평은 문학과지성사 웹사이트에서 확인할 수 있다.",국내도서>소설/시/희곡>한국소설>2000년대 이후 한국소설,https://image.aladin.co.kr/product/35337/31/coversum/8932043396_1.jpg
9788937463006,이상 소설 전집,"이상 (지은이), 권영민 (엮은이)",2012-11-05,이상 소설 전집. 실험적 구성과 파격적 문체를 통해 식민지 근대 한국과 그 시기를 살아 낸 사람들의 혼란스럽고 불안한 내면 심리를 형상화한 이상. 실험성과 전위성으로 인해 오늘날에도 다양한 비평 담론과 논쟁을 야기하는 이상의 소설을 한 권에 엮었다.,국내도서>소설/시/희곡>한국소설>2000년대 이전 한국소설,https://image.aladin.co.kr/product/2062/36/coversum/8937463008_2.jpg
9788965820499,"한국고전소설 40 - 중고생이 꼭 읽어야 할, 개정증보판","박지원 (지은이), 권정현, 김형주 (엮은이)",2013-01-09,"청소년 문학 분야 베스트셀러인 &lt;한국고전소설 35&gt;의 개정 증보판이다. 중고등학교 교과서 개정과 교육 과정 개편에 따라 꼭 포함되야 할 필독 작품을 빠짐없이 추가하고, 수능·논술·내신을 위해 내용을 충실하게 보완했다.",국내도서>청소년>논술참고도서,https://image.aladin.co.kr/product/2248/65/coversum/8965820499_3.jpg
9788965820482,"한국단편소설 70 - 중고생이 꼭 읽어야 할, ‘인물 관계도’ 수록, 개정증보판","박완서 (지은이), 박찬영, 성낙수 (엮은이)",2019-07-23,『한국단편소설 40』에 이어 수능·논술·내신을 위해 청소년이 꼭 읽어야 할 한국 단편 소설 30편을 추가로 엄선했다. 단편 소설 70편의 전문을 수록해 완전한 감상을 유도한다. 또한 풍부하고 충실한 해설을 담아 이해를 돕는다.,국내도서>청소년>논술참고도서,https://image.aladin.co.kr/product/20566/70/coversum/8965820480_2.jpg
9788936458812,국어 교과서 작품 읽기 중2 소설 (전면개정판),"서덕희, 최은영 (엮은이)",2018-12-10,2010년 첫 선을 보인 이래 지금까지 170만 독자에게 선택받은 검증된 시리즈 ‘국어 교과서 작품 읽기’가 전면 개정판으로 완전히 새로워졌다. 이번에 다시 한번 개정된 교육 과정에 맞추어 2019학년도 중2 국어 교과서에 대비하는 전면 개정판을 낸다.,국내도서>청소년>중등교육과정,https://image.aladin.co.kr/product/17552/38/coversum/8936458817_2.jpg
9788936431440,국어 교과서 작품 읽기 중1 소설 (최신개정판),"김아란, 주예지 (엮은이)",2024-12-20,"개정 교육 과정에 따른 교과서 10종 가운데 어느 것을 배우는 학생이나 꼭 읽어야 할 시, 소설, 수필·비문학 글들을 소개한다. 여러 교과서에 중복해서 실린 필수 작품, 시대의 변화에 발맞추어 교과서에 처음 수록된 작품 등을 다채롭게 엮었다.",국내도서>청소년>중등교육과정,https://image.aladin.co.kr/product/35236/51/coversum/8936431447_1.jpg
9788932042343,소설 보다 : 겨울 2023,"김기태, 성해나, 예소연 (지은이)",2023-12-07,"독자에게 늘 기대 이상의 가치를 전하는 특별 기획, 『소설 보다: 겨울 2023』이 출간되었다. 2023년 겨울 ‘이 계절의 소설’ 선정작인 김기태 「보편 교양」, 성해나 「혼모노」, 예소연의 「우리는 계절마다」 총 3편과 작가 인터뷰가 실렸다.",국내도서>소설/시/희곡>한국소설>2000년대 이후 한국소설,https://image.aladin.co.kr/product/32977/63/coversum/8932042349_1.jpg
9788965820512,"세계단편소설 40 - 중고생이 꼭 읽어야 할, 개정증보판","오 헨리 (지은이), 박선희 (엮은이), 박찬영 (옮긴이)",2013-01-18,"중고등학교 교과서 개정과 교육 과정 개편에 따라 꼭 포함돼야 할 필독 작품을 빠짐없이 추가하고, 수능.논술.내신을 위해 내용을 충실하게 보완했다. 40편이란 최다 작품을 수록하면서도 전문을 실어 완전한 감상을 할 수 있도록 했다.",국내도서>청소년>논술참고도서,https://image.aladin.co.kr/product/2272/91/coversum/8965820510_3.jpg
9791194523185,소설의 기술 - 젊은 작가들을 위한 창작 노트,"존 가드너 (지은이), 황유원 (옮긴이)",2025-02-12,존 가드너는 소설가로 유명했던 것만큼이나 문예창작론 강사로도 유명했다. 자신이 했던 수업과 세미나에 기초한 이 실용적이고 유익한 안내서에서 그는 훌륭한 글의 원리와 테크닉을 간단하고도 설득력 있게 설명한다.,국내도서>인문학>책읽기/글쓰기>글쓰기,https://image.aladin.co.kr/product/35898/91/coversum/k462037089_1.jpg
9788932042824,소설 보다 : 여름 2024,"서장원, 예소연, 함윤이 (지은이)",2024-06-07,"독자에게 늘 기대 이상의 가치를 전하는 특별 기획, 『소설 보다 : 여름 2024』가 출간되었다. 2024년 여름 ‘이 계절의 소설’ 선정작인 서장원의 「리틀 프라이드」, 예소연의 「그 개와 혁명」, 함윤이의 「천사들(가제)」 총 세 편과 작가 인터뷰가 실렸다.",국내도서>소설/시/희곡>한국소설>2000년대 이후 한국소설,https://image.aladin.co.kr/product/34070/24/coversum/8932042829_1.jpg
9791136734518,소설 주술회전 1 - 떠나가는 여름과 돌아오는 가을,"아쿠타미 게게, 기타구니 발라드 (지은이), 유유리 (옮긴이)",2021-05-25,"사토자쿠라 고등학교에서 사건이 벌어진 뒤, 이타도리는 어떤 저주 때문에 고민하는 소년을 만난다. 아무리 쓰러뜨려도 계속 부활하며 소년을 공격하는 저주. 그리고 준페이를 구하지 못했다는 후회로 자신감을 잃은 이타도리에게 고죠는 어떤 질문을 던지는데….",국내도서>소설/시/희곡>라이트 노벨>기타 라이트노벨,https://image.aladin.co.kr/product/27074/7/coversum/k502731589_1.jpg
9791141138998,카모노하시 론의 금단추리 13,아마노 아키라 (지은이),2025-03-13,,국내도서>만화>본격장르만화>추리/미스터리,https://image.aladin.co.kr/product/36034/40/coversum/k382037631_1.jpg
9791136798718,허구추리 22 - Invented inference,"카타세 차시바 (지은이), 시로다이라 교 (원작), 오경화 (옮긴이)",2025-02-14,"사쿠라가와 쿠로의 고등학교 동창 ‘사가라 나츠히코’와 ‘우키타 마리나’. 각각 다른 장소, 시간대에서 쿠로와 우연히 재회했을 때, 마음속에 숨겨뒀던 마음이 오가며 사건의 수수께끼는 가속한다.",국내도서>만화>본격장르만화>추리/미스터리,https://image.aladin.co.kr/product/35800/60/coversum/k492036454_1.jpg
9788969655196,2025 해커스 GSAT 삼성직무적성검사 통합 기본서 최신기출유형 + 실전모의고사 (수리/추리) - 온라인 시험 대비 | 모의고사 5회분 | 전 회차 온라인 응시 서비스 | 무료 바로 채점 및 성적 분석 서비스,해커스 GSAT 취업교육연구소 (지은이),2025-01-02,최신 출제경향을 반영한 이론과 문제로 수리/추리 영역의 빈출 유형과 유형별 공략법을 파악하고 효율적으로 학습할 수 있다. 이후 최신기출동형문제 및 출제예상문제와 실전모의고사를 풀어보며 한 권으로 GSAT 최신기출유형을 완전 정복할 수 있다.,국내도서>수험서/자격증>취업/상식/적성>기업 적성검사>GSAT(SSAT),https://image.aladin.co.kr/product/35422/40/coversum/8969655190_1.jpg
9788966348718,2026학년도 LEET 대비 파이널 실전 모의고사 추리논증 - 개정 4판,메가로스쿨 언어논리연구소 (지은이),2025-03-14,"메가로스쿨 언어논리연구소에서는 7단계 검증 시스템을 통해 본고사와 내용 구성 및 난이도 유사성이 높은 문항만을 선별하였고, 실전 감각을 최대한 끌어올릴 수 있도록 시험지 크기와 재질을 본고사와 동일하게 재현하여 파이널 실전 모의고사를 제작하였다.",국내도서>수험서/자격증>LEET:법학적성시험>추리논증,https://image.aladin.co.kr/product/35989/0/coversum/8966348718_1.jpg
9788937838750,추리 천재 엉덩이 탐정 1 - 보라 부인의 암호 사건,"트롤 (지은이), 김정화 (옮긴이)",2016-08-10,"일본에서 큰 사랑을 받고 있는 아이큐 1,104의 추리 천재, ‘엉덩이 탐정’이 주인공인 초등 저학년 어린이들을 위한 추리 동화이다. 동화 글과 화려한 올컬러 삽화, 만화 구성으로 펼쳐져, 초등 저학년 어린이들의 흥미와 관심을 단번에 사로잡고 추리력과 사고력을 키워 줄 것이다.",국내도서>어린이>동화/명작/고전>외국창작동화,https://image.aladin.co.kr/product/8920/23/coversum/8937838753_1.jpg
9791162339466,추리 천재 엉덩이 탐정 7 - 기이한 전망 여관 사건,"트롤 (지은이), 김정화 (옮긴이)",2018-12-20,"초등 저.중학년 수준에 딱 맞는 추리 난이도를 설정하여, 어린이 독자들이 자신의 추리력을 시험해 볼 수 있도록 기발한 사건들을 다룬다. 이번 7권에서 엉덩이 탐정은 코알라 양의 의뢰를 받아, 어둠 속에서 단 하나의 단서도 놓치지 않으려는 날카로운 관찰력을 보여준다.",국내도서>어린이>동화/명작/고전>외국창작동화,https://image.aladin.co.kr/product/17457/14/coversum/k792534209_1.jpg
9791164134090,추리 천재 엉덩이 탐정 9 - 세 마리 행운 고양이 사건,"트롤 (지은이), 김정화 (옮긴이)",2020-01-15,"초등 저.중학년 수준에 딱 맞는 추리 난이도를 설정하여, 어린이 독자들이 자신의 추리력을 시험해 볼 수 있도록 기발한 사건들을 다룬다. 이번 9권에서는 ‘괴도 아카데미’의 정체가 본격적으로 드러나기 시작하면서 이야기를 더욱 흥미롭게 이끌어 간다.",국내도서>어린이>동화/명작/고전>외국창작동화,https://image.aladin.co.kr/product/22712/95/coversum/k102636135_1.jpg
9791162335123,추리 천재 엉덩이 탐정 6 - 수상한 탐정 사무소 사건,"트롤 (지은이), 김정화 (옮긴이)",2018-05-30,"초등 저.중학년 수준에 딱 맞는 추리 난이도를 설정하여, 어린이 독자들이 자신의 추리력을 시험해 볼 수 있도록 기발한 사건들을 다뤘다. 추리 천재 엉덩이 탐정과 열정 넘치는 조수 브라운이 수상한 냄새를 풍기는 낯선 탐정 ‘캐롯 말스’의 정체를 파헤치는 흥미진진한 이야기다.",국내도서>어린이>동화/명작/고전>외국창작동화,https://image.aladin.co.kr/product/14334/2/coversum/k272532049_1.jpg
9791164131914,추리 천재 엉덩이 탐정 8 - 괴도와 납치된 신부 사건,"트롤 (지은이), 김정화 (옮긴이)",2019-07-25,"초등 저.중학년 수준에 딱 맞는 추리 난이도를 설정하여, 어린이 독자들이 자신의 추리력을 시험해 볼 수 있도록 기발한 사건들을 다룬다. 이번 8권에서는 4권에서 처음 등장한 반가운 인물, ‘괴도 유’가 오랜만에 다시 등장한다.",국내도서>어린이>동화/명작/고전>외국창작동화,https://image.aladin.co.kr/product/19874/27/coversum/k432635431_2.jpg
9788937853470,추리 천재 엉덩이 탐정 2 - 어둠 속으로 사라진 거인 사건,"트롤 (지은이), 김정화 (옮긴이)",2016-11-25,"입으로 뀌는 ‘방귀’로 사건을 해결하는 반전 매력의 주인공, ‘추리 천재 엉덩이 탐정’과 함께 수수께끼를 풀고, 미로를 지나고, 숨은 그림을 찾다 보면 추리력과 사고력이 쑥쑥 자라나는 동화이다. 어린이 독자들이 자신의 추리력을 시험해 볼 수 있도록 기발한 사건들을 다뤘다.",국내도서>어린이>동화/명작/고전>외국창작동화,https://image.aladin.co.kr/product/9740/72/coversum/8937853477_1.jpg
9791164130764,추리 천재 엉덩이 탐정과 카레 사건,"트롤 (지은이), 김정화 (옮긴이)",2019-05-01,"추리 천재 엉덩이 탐정 S 시리즈. 초등 저.중학년 수준에 딱 맞는 추리 난이도를 설정하여, '추리 천재 엉덩이 탐정' 시리즈를 읽고 추리의 기본을 잘 다진 어린이 독자들이 자신의 추리력을 시험해 볼 수 있도록 기발한 사건을 다뤘다.",국내도서>어린이>동화/명작/고전>외국창작동화,https://image.aladin.co.kr/product/18955/61/coversum/k932635484_1.jpg
