﻿book_id,title,author,pub_date,description,category,cover
9791162936276,"2025 경영조직 전략노트 목차키워드 - 공인노무사·경영지도사 대비, 제9판",김유미 (지은이),2025-03-25,"방대한 내용의 경영조직을 수험생 입장을 고려하여 실제 시험에서 답안을 현출할 수 있도록 콤팩트하게 요약·정리한 교재로 목차, 개념, 키워드, 그림, 도표, 용어사전으로 구성하였다.",국내도서>수험서/자격증>국가전문자격>공인노무사,https://image.aladin.co.kr/product/36069/51/coversum/k612037143_1.jpg
9788947545143,피터 드러커의 자기경영노트,"피터 드러커 (지은이), 장영철 (옮긴이)",2024-05-30,누구나 반드시 한 번은 읽어야 할 경제경영서라는 찬사를 받는 《피터 드러커 자기경영노트》의 개정 5판 새 번역본이 출간되었다. 피터 드러커 소사이어티 장영철 공동대표가 번역한 이번 판은 발간 50주년 기념 짐 콜린스의 서언이 수록되어 있다.,국내도서>경제경영>[경제경영 사상가 20인]>피터 드러커,https://image.aladin.co.kr/product/34014/99/coversum/8947545147_2.jpg
9791191026436,"IBK기업은행 직무수행능력 경영경제 400제 - 핵심 기출복원, 기출동형 실전모의고사 10회분",혼Job취업연구소 (지은이),2022-08-12,,국내도서>수험서/자격증>취업/상식/적성>기업 적성검사>은행/금융/언론사,https://image.aladin.co.kr/product/29943/77/coversum/k312838634_1.jpg
9791196297268,인문과 과학으로 보는 통찰경영 - K-경영이 글로벌 스탠더드가 되다,"이승한, 김연성, 최동현, 이평수, 이성호, 정연승, 김범수, 설도원 (지은이)",2025-02-18,이승한 N&P 경영연구그룹 회장의 &lt;인문과 과학으로 보는 통찰경영&gt;은 격변하는 시대에 필요한 새로운 경영 패러다임을 제시한다.  저자는 55년간 현장에서 쌓아온 경험과 통찰을 바탕으로 한국 경영자들이 직면한 위기를 헤쳐 나갈 길을 모색한다.,국내도서>경제경영>기업 경영>경영전략/혁신,https://image.aladin.co.kr/product/35862/49/coversum/k612037576_1.jpg
9791166475559,행복 경영의 비밀,최동규 (지은이),2025-04-15,"존중(Respect), 성장(Growth), 유능(Competence), 지지(Support), 자유(Freedom)라는 다섯 가지 요소는 조직 구성원이 행복하게 일할 수 있는 터전을 만들고 조직문화를 혁신하여 지속 가능한 성장을 이끌어내는 원동력을 만들어 준다.",국내도서>경제경영>기업 경영>경영 일반,https://image.aladin.co.kr/product/36203/42/coversum/k692038695_1.jpg
9791191569360,2025 유튜브와 함께하는 양쌤의 품질경영기사 필기 - 최신개정 5판,양희정 (지은이),2025-01-20,"품질경영기사 시험 범위에 꼭 필요한 이론으로 편집하였고, 술술 풀어쓰는 노트를 병기하여 암기 팁, 찍기 팁, 잘 나오는 문제 등으로 핵심이 술술 제시되어 있다. 오직 품질경영기사문제로만 20년간 출제 경향을 분석하여 구성하였다.",국내도서>수험서/자격증>국가기술자격>생산관리>품질경영/산업기사,https://image.aladin.co.kr/product/35099/47/coversum/k992934507_1.jpg
9788927457268,2025 배극윤의 품질경영기사 필기 문제풀이 - 전2권,배극윤 (지은이),2025-02-10,2017년부터 2024년 3회까지 출제된 모든 문제를 수록하였다. 문제부분과 해설부분을 별도로 분리함으로써 실제 시험과 같이 교재를 편집하였다. 모든 문제는 완전 100% 해설을 달았다. 각 문제에 중요도 표시와 2차 시험문제와의 연관성 표시로서 [실기]라 표기하였다.,국내도서>수험서/자격증>국가기술자격>생산관리>품질경영/산업기사,https://image.aladin.co.kr/product/35590/89/coversum/8927457269_1.jpg
9788965702450,경영의 모험 - 빌 게이츠가 극찬한 금세기 최고의 경영서,"존 브룩스 (지은이), 이충호 (옮긴이), 이동기 (감수)",2015-03-09,빌 게이츠가 자신의 홈페이지와 '월스트리트저널'을 통해 “내가 읽은 최고의 경영서”라고 추천하면서 43년 만에 다시 출간된 경영서의 고전. 이 책은 시간이 오래 흘러도 변치 않는 기업의 본질과 기업의 생태계 안에서 치열하게 살아가는 인간의 본성을 깊이 들여다보는 책이다.,국내도서>경제경영>기업 경영>경영전략/혁신,https://image.aladin.co.kr/product/5320/57/coversum/8965702453_2.jpg
9788927457992,2025 배극윤의 품질경영기사.산업기사 실기 - 전2권 - 16차 개정,배극윤 (지은이),2025-04-10,"품질경영기사.산업기사 실기를 대비할 수 있는 수험서다. 변경된 출제기준에 의거 2차 실기시험을 준비하는 수험생을 위하여 출간하였다. 2024년 변경된 최신 출제경향에 맞추어 내용을 재구성하였고, 지난 10여 년간의 출제문제를 완전분석하여 해설을 실었다.",국내도서>수험서/자격증>국가기술자격>생산관리>품질경영/산업기사,https://image.aladin.co.kr/product/36041/25/coversum/8927457994_1.jpg
9791165346485,천 원을 경영하라 - 국민가게 다이소 창업주 박정부 회장의 본질 경영,박정부 (지은이),2022-12-01,"전국 1,500개 매장에 하루 100만 명의 고객이 찾아오고, 1시간에 42만 개씩 상품이 팔리는 곳, 매월 600종의 신상품이 나오고, 1,000원짜리 상품이 주력인데 연매출이 3조나 되는 곳, 25년간 단 한 번도 당기순손실을 낸 적이 없고, 2030이 가장 좋아하는 라이프스타일숍 1위로 뽑힌 곳…, 바로 균일가 생활용품점 다이소 이야기다.",국내도서>경제경영>기업/경영자 스토리>국내 기업/경영자,https://image.aladin.co.kr/product/30493/49/coversum/k652830483_1.jpg
9791190819077,한 권으로 끝장내자 경리회계 인사노무 경영지원 실무 설명서,손원준 (지은이),2025-01-10,"가장 신속하고 정확하게 여러분의 업무 고민을 쉽게 해결해 주는 내 손 안의 업무 백과사전. 이 책은 총 11장으로 구성을 했으며, 회계에서부터 세금까지 그뿐만 아니라 인사노무와 4대 보험까지 이 책 한 권으로 모든 업무를 끝장낸다는 생각으로 구성했다.",국내도서>경제경영>기업 경영>조직/인력/성과관리,https://image.aladin.co.kr/product/25812/74/coversum/k772736335_2.jpg
9791130321677,SAP ERP 경영,"함용석, 김아현 (지은이)",2025-03-07,"SAP ERP를 처음 배우는 학생을 대상으로 하며, 더 나아가 실무에 서 SAP ERP를 활용하는 컨설턴트나 내부 사용자들에게 실질적인 도움이 될 수 있도록 구성하였다. 또한 SAP ERP의 기본 개념뿐만 아니라 실무에서 발생할 수 있는 다양한 사례를 담아 보다 현실적인 접근이 가능하도록 하였다.",국내도서>대학교재/전문서적>경상계열>경영학,https://image.aladin.co.kr/product/35977/94/coversum/k992037902_1.jpg
9791171176373,"경영, 이나모리 가즈오 원점을 말하다","이나모리 가즈오 (지은이), 이나모리 라이브러리, 다이아몬드사 '이나모리 가즈오 경영 강연 선집' 공동팀 (엮은이), 양준호 (옮긴이)",2024-06-26,"이나모리 가즈오 명예회장의 파란만장했던 경영 이력과 경영철학, 그리고 이 모든 것을 이룰 수 있었던 그의 경영 원칙을 완결한 책이다. 그의 생전에 기획되어 유지를 받든 이나모리 라이브러리가 완성한 책으로 1970년대부터 2010년대까지 수많은 강연에서 이나모리 경영론의 핵심을 발췌하였다.",국내도서>경제경영>기업 경영>경영 일반,https://image.aladin.co.kr/product/34082/24/coversum/k552931088_3.jpg
9791163864141,2025 경영정보시각화능력 실기 한권완성 Power BI - 빅데이터 신설 국가기술자격증 / 핵심이론+상세한 작업과정 풀이 수록 / 시행처 공개문제(A#B형) 수록 / 모의고사 3회분 수록 / 2024년 제1회 기출문제 최초 복원 수록,"최형규, 정경문 (지은이)",2025-02-10,실습에 최적화된 핵심이론과 기출문제와 유사한 형태의 지시문을 수록하여 Power BI에 대한 완벽한 이해가 이루어질 수 있도록 하였다. 시행처에서 공개한 문제 A·B형을 모두 수록하여 수험생들이 출제 경향을 파악할 수 있도록 하였다.,국내도서>컴퓨터/모바일>활용능력>신규 자격증/자격증 기타,https://image.aladin.co.kr/product/35632/53/coversum/k252036490_1.jpg
9791166335242,2025 독학사 2단계 경영정보론 - 024년 기출문제 복원 수록! 최신 기출문제 해설강의 무료! 기출유형 다잡기 수록,황사빈 (지은이),2025-03-10,"2024년 기출문제를 완벽 복원하여 수록하였다. 최신 출제경향에 맞춘 핵심 이론을 정리하였으며, 기출유형 다잡기를 수록하였다.",국내도서>수험서/자격증>편입/검정고시/독학사>독학사>경영학과,https://image.aladin.co.kr/product/35952/75/coversum/k432037909_1.jpg
9788960601222,서울대 최종학 교수의 숫자로 경영하라 - 회계로 경영을 말한다,최종학 (지은이),2009-07-17,"홍콩과학기술대학에서 6년 연속 최고강의상을 수상하고, 서울대학교 최초로 우수연구상과 우수강의상을 동시에 수상하는 등 회계분야의 세계적 학자로 인정받고 있는 최종학 교수가 경영자들이 숫자하는 도구로 큰 그림을 보고, 이를 이해해서 경영에 접목시킬 수 있도록 하기 위해 집필한 책이다.",국내도서>경제경영>기업 경영>세무/재무/회계,https://image.aladin.co.kr/product/425/9/coversum/8960601225_1.jpg
9791193063866,"일하는 사장의 생각 - 청기와타운 양지삼 대표가 말하는 장사와 경영, 그리고 브랜드",양지삼 (지은이),2025-03-08,식당 직원에서 시작해 연 매출 400억 원의 브랜드를 만든 청기와타운 대표 양지삼이 전하는 생존전략이다. 단순한 창업 지침서가 아니라 자신의 경험을 바탕으로 실제 장사에서 부딪히는 문제들을 해결하고 지속 가능한 브랜드를 만들어가는 생생한 과정을 담았다.,국내도서>경제경영>기업 경영>경영전략/혁신,https://image.aladin.co.kr/product/35835/55/coversum/k972037860_2.jpg
9788934914716,경영이란 무엇인가,"조안 마그레타 (지은이), 권영설, 김홍열 (옮긴이)",2004-12-27,"피터 드러커가 ""읽기 쉽게 썼기 때문에 경영을 하지 않는 초심자들에게도 훌륭한 지침서가 될 것이다. 종합적인 접근 방식을 취하고 있어 노련한 경영자들을 위한 복습용 경영서로도 손색이 없다""고 평가한 책. 비즈니스 세계에 처음 입문한 이들을 위한 안내서이자 '경영'이라는 규율을 소개한 경영 바이블이다.",국내도서>경제경영>기업 경영>경영 일반,https://image.aladin.co.kr/product/53/56/coversum/8934914718_1.jpg
9791138388221,2025 시대에듀 유선배 경영정보시각화능력 실기(Power BI) 합격노트 - 유튜브 무료 동영상 강의 제공,어니언비아이 (지은이),2025-05-20,"Power BI 프로그램의 내용과 실무적 응용 방법을 체계적으로 다룬 수험서다. Power BI 프로그램을 처음 다뤄보는 수험생도 이해할 수 있도록 파워쿼리 편집기, 모델링, DAX 함수 등 핵심 기능의 기초부터 차근차근 수록했다.",국내도서>컴퓨터/모바일>활용능력>신규 자격증/자격증 기타,https://image.aladin.co.kr/product/36114/75/coversum/k522038066_1.jpg
9791130321622,생명 경영 원칙,이견직 (지은이),2025-03-11,,국내도서>대학교재/전문서적>경상계열>경영학,https://image.aladin.co.kr/product/35947/82/coversum/k012037809_1.jpg
9791192907703,시부사와 에이이치의 윤리경영 리더십 - &lt;NHK 100분 명저&gt;의 저자에게 배우는 논어와 주판 철학,"모리야 아쓰시 (지은이), 이주영 (옮긴이)",2025-03-13,"시부사와 에이이치의 경영 철학과 리더십을 다룬 책으로, &lt;NHK 100분 명저&gt;의 저자이자 현대인이 활용할 수 있는 《논어》의 지혜를 강의하는 모리야 아쓰시가 NHK 출판사와 함께 펴낸 최고의 시부사와 에이이치 평전이다.",국내도서>경제경영>기업 경영>경영 일반,https://image.aladin.co.kr/product/36041/16/coversum/k622037745_1.jpg
9791172245719,탐정과 ESG 경영 - ESG 경영을 탐정이 돕는다,"문봉수, 곽대순 (지은이)",2025-04-02,"탐정 교육을 담당하는 저자는 탐정업의 현재와 미래를 살펴보고 있다. 법제화를 위해 어떤 노력을 기울여야 하는지, 국내외 탐정업의 실태가 어떠한지에 관해 상세한 정보를 주고 있다. 그리고 이 탐정업이 단순한 조사원 업무가 아니라, 기업 경영에서 핵심 요소인 ESG와 접목하여 발전해 가는 직종으로서 로드맵을 보여 주고 있다.",국내도서>경제경영>기업 경영>경영 일반,https://image.aladin.co.kr/product/36137/5/coversum/k232038573_1.jpg
9791193239162,사모펀드 투자와 경영의 비밀,김태엽 (지은이),2024-10-25,사모펀드 운용사 ‘어펄마캐피탈’의 한국 대표인 김태엽이 사모펀드 업계에 관해 쓴 책이다. 놀라운 성과를 만들어가고 있는 어펄마캐피탈의 한국 대표 김태엽이 쓴 이 책에는 사모펀드가 투자의 성공을 위해 구사하는 갖가지 경영전략과 투자의 인사이트가 담겨 있다.,국내도서>경제경영>재테크/투자>주식/펀드,https://image.aladin.co.kr/product/35048/39/coversum/k512934082_1.jpg
9788996222637,자기경영 노트 - &lt;김밥 파는 CEO&gt; 김승호의,김승호 (지은이),2010-01-10,"미국에서 무일푼으로 시작하여 김밥 하나로 700억 원대 기업체를 일군 신화의 주인공, JFE사 CEO 김승호가 기적 같은 성공의 노하우를 전한다. 이 책에는 몇 번의 좌절을 겪으면서도 끝없는 용기와 열정으로 성공 신화를 만들어가는 저자의 기적의 방정식이 고스란히 녹아 있다.",국내도서>경제경영>CEO/비즈니스맨을 위한 능력계발>성공학/경력관리,https://image.aladin.co.kr/product/602/87/coversum/8996222631_2.jpg
9791194322078,평생 투자자 - 일본 주식시장의 판을 흔들어 깨운 담대한 도전들,"무라카미 요시아키 (지은이), 김정환 (옮긴이), 심혜섭 (감수)",2025-05-10,"손대는 기업마다 큰 성공을 거둬 ‘신의 손’으로 불린 전설의 투자자. 일본 주식 투자금만 4,000억 엔(약 4조 원) 넘게 운용한 무라카미펀드의 창립자 무라카미 요시아키(村上世彰)를 가리키는 말이다. 통상산업성(현 경제산업성) 관료 출신으로, 성공한 투자자일 뿐만 아니라 기업 거버넌스와 주주 가치 실현의 최일선에서 일본 경제와 주식시장의 판을 바꾼 이가 바로 무라카미 요시아키다.",국내도서>경제경영>재테크/투자>재테크/투자 일반,https://image.aladin.co.kr/product/36257/48/coversum/k392038623_1.jpg
9791191378696,"배당성장주 투자 불변의 법칙 - 평생 월급 1,000만 원 받는 배당투자 시크릿",현영준(한라산불곰) (지은이),2025-02-26,"주식투자의 매력에 빠져 다니던 대기업을 퇴사한 뒤, 단 6년 만에 조기 은퇴에 성공한 한라산불곰이 꼼꼼하게 정리한 배당성장주 투자의 모든 것. 배당투자는 심심하고 수익률도 낮다는 선입견을 부수며 2년 만에 자산을 5배로 불리고 해마다 첫 투자금만큼의 배당금을 받게 해준, 안정성과 시세차익까지 거머쥘 수 있는 가이드를 준비했다.",국내도서>경제경영>재테크/투자>주식/펀드,https://image.aladin.co.kr/product/35872/84/coversum/k582037780_1.jpg
9791140712663,가속화 장기투자 법칙 - 4000만 원으로 시작해 40억 만든 가치주 복리 혁명,임인홍(오일전문가) (지은이),2025-03-25,《가속화 장기투자 법칙》은 제목이 주는 느낌처럼 장기투자를 하지만 자산의 증가를 ‘가속화’하는 방법에 관한 내용을 담고 있다. 장기투자란 단어의 표면적인 시간적 의미를 뛰어넘어 제대로 실행된 장기투자는 투여한 돈을 급속도로 불려주는 핵심 수단임을 알아채는 것이 중요하다.,국내도서>경제경영>재테크/투자>주식/펀드,https://image.aladin.co.kr/product/35978/51/coversum/k572037904_1.jpg
9791192044576,수민이의 미국 주식 투자 스토리 - 주린이 뉴요커의 주식 호구 탈출기,이주택 (지은이),2025-03-21,"《다시 오는 기회, 미국 주식이 답이다》로 미국 주식 전문가로 이름을 날리고 있는 이주택 럿거스 로스쿨(Rutgers Law School) 종신교수의 신작으로, 소설 형식을 통해 가독성과 재미를 극대화한 ‘미국 주식 투자 지침서’이다.",국내도서>경제경영>재테크/투자>주식/펀드,https://image.aladin.co.kr/product/36001/52/coversum/k622037725_1.jpg
9791138388481,2025 시대에듀 투자자산운용사 실제유형 모의고사 + 특별부록 PASSCODE Premium ver 9.0 - 25년 기본서 개정사항 및 기출분석(19년 ~ 24년 + 25년 1월 시험) 완벽 반영 / 프리미엄 강의노트(2회분) / 특별부록Ⅰ 빈출포인트 O/X퀴즈 + Ⅱ 실제유형문제 추가 풀(100문항),유창호 (지은이),2025-03-10,"실제 문제에 가장 가까운 문제로만 구성된 모의고사로 구성되었다. 프리미엄강의노트(2회분)와 기출풀복원강의(유료) 할인쿠폰을 제공하고, 자가 오답정리를 통해 약점을 보완할 수 있도록 해설을 풍부하게 담았다.",국내도서>수험서/자격증>민간자격>투자자산운용사,https://image.aladin.co.kr/product/35950/68/coversum/k172037804_1.jpg
9791193394625,마인드셋은 어떻게 투자의 무기가 되는가 - 초수익을 만드는 사고방식의 비밀,"마크 미너비니 (지은이), 장진영 (옮긴이)",2025-03-15,"『초수익 성장주 투자』, 『초수익 모멘텀 투자』, 『챔피언처럼 생각하고 거래하라』에 이은 저자의 네 번째 책으로 그가 쓴 저작 중 국내에 출간되지 않은 유일한 도서이기도 하다. 마인드를 바꾸고 싶지만 바꾸지 못해 전전긍긍하는 투자자들에게 저자는 이 책을 통해 ‘어떻게’ 해야 하는지에 대한 명확한 방향을 제시한다.",국내도서>경제경영>재테크/투자>주식/펀드,https://image.aladin.co.kr/product/35803/34/coversum/k262036550_1.jpg
9791191484304,"투자, 진화를 만나다 - 종의 생존과 번영에서 찾아낸 투자의 길","풀락 프라사드 (지은이), 안세민 (옮긴이)",2025-02-10,"금융위기와 코로나19 위기를 이겨내고 2007년부터 2023년까지 인도 주식에만 집중해서 연평균 20.3%의 수익률을 낸 한 투자자가 진화생물학, 즉 종의 생존과 번성에서 투자, 부, 더 나아가 인생의 핵심 문제들에 대한 지혜를 찾아낸 기록이다.",국내도서>경제경영>재테크/투자>재테크/투자 일반,https://image.aladin.co.kr/product/35728/20/coversum/k472036432_1.jpg
9791140707492,처음부터 시작하는 주식투자 단타전략 - 15만 원으로 10억 만든 실전투자대회 1위 수상자의 필승 트레이딩 공식,홍인기 (지은이),2023-12-22,"카카오TV, 넷플릭스 방영 &lt개미는 오늘도 뚠뚠&gt 전 챕터 최고 수익률 133%, MZ세대 대왕개미의 투자법. 여의도 제도권 취업보다 전업투자를 선택하게 만든 안전한 주식 단기 매매 공식을 담은 책이다.",국내도서>경제경영>재테크/투자>주식/펀드,https://image.aladin.co.kr/product/33034/23/coversum/k912937580_1.jpg
9791138388634,2025 시대에듀 투자자산운용사 한권으로 끝내기 ver 15 - 25년 기본서 개정사항 반영 / 최신 출제경향(19년 ~ 25년 1월 시험) 완벽 반영 / 워밍업! 핵심정리노트 + 핵심유형문제 + 보충문제 + 추가 보충문제 + 최종모의고사 2회분,유창호 (지은이),2025-03-05,"금융투자협회에서 발간하는 2025년 투자자산운용사 기본서에 준거한 문제집으로, ‘출제경향을 반영한 문제’와 ‘첨삭식 해설’을 통해 기본서에 담긴 내용을 체계적으로 이해하고 효율적으로 시험에 합격할 수 있도록 구성되었다.",국내도서>수험서/자격증>민간자격>투자자산운용사,https://image.aladin.co.kr/product/35854/71/coversum/k472037476_1.jpg
9788949137049,멸망에 투자하세요 - 제5회 틴 스토리킹 수상작,황이경 (지은이),2025-03-14,"미래에 대한 예측 시스템이 지배하는 세상, 인공지능의 발달로 대부분의 사람이 단순 노동직에 머물게 된 현실 속에서 인간은 자신의 미래를 다채롭게 꿈꿀 수 있을까? 더군다나 자신에게 주어진 미래가 멸망뿐이라면? 혼잡한 현실을 살아가고 있는 지금 우리에게 꼭 필요한 질문들을 던진다.",국내도서>청소년>청소년 문학>청소년 소설,https://image.aladin.co.kr/product/36041/32/coversum/8949137046_1.jpg
9791172445164,2025 해커스 투자자산운용사 한권합격 핵심개념 + 적중문제 - 본 교재 인강ㅣ무료 바로 채점 및 성적 분석 서비스ㅣ이론정리+문제풀이 무료 특강ㅣ하루 10분 개념완성 자료집ㅣ필수암기공식,"백영, 송현남, 민영기, 조중식, 해커스 금융아카데미 (지은이)",2025-03-14,"투자자산운용사를 대비할 수 있는 핵심개념 + 적중문제 수험서다. 2025 주관처 기본서 개정사항 및 최근 출제경향을 반영하였고, 핵심개념 정리부터 문제풀이까지 한 권으로 완성할 수 있도록 구성하였다. 투자자산운용사 학습 효과를 높이는 다양한 학습 콘텐츠를 제공한다.",국내도서>수험서/자격증>민간자격>투자자산운용사,https://image.aladin.co.kr/product/36001/34/coversum/k272037725_1.jpg
9791171171989,나는 배당투자로 매일 스타벅스 커피를 공짜로 마신다 - 평생 월 500만 원씩 버는 30일 기적의 배당 파이프라인 공략집,송민섭(수페TV) (지은이),2023-12-06,"트렌디한 분석과 진정성 있는 콘텐츠로 수십만 투자자들에게 사랑받는 유튜브 채널 ‘수페TV’의 운영자 송민섭이, 경제적 자유를 이루고 싶은 사람들과 부의 파이프라인을 마련하고 싶은 사람들을 위해 30일 만에 마스터하는 배당 투자 실전 노하우를 전한다.",국내도서>경제경영>재테크/투자>재테크/투자 일반,https://image.aladin.co.kr/product/32956/53/coversum/k482936243_1.jpg
9791171713134,K-방산에 투자하라,김민석 (지은이),2025-02-05,"트럼프 2.0 시대 최고 수혜주, K-방산에 주목하라! 기술부터 제품, 시장, 산업 지도까지, K-방산의 과거와 미래를 통해 찾아낸 새로운 투자 전략.",국내도서>경제경영>재테크/투자>재테크/투자 일반,https://image.aladin.co.kr/product/35686/4/coversum/k492036926_1.jpg
9788957821305,"현명한 투자자 - 벤저민 그레이엄 직접 쓴 마지막 개정판, 개정4판","벤저민 그레이엄 (지은이), 이건 (옮긴이), 신진오 (감수)",2020-05-26,"초보 투자자도 건전한 투자 전략을 수립하고 실행할 수 있도록 안내하는 투자서다. 그래서 증권분석 기법은 많이 다루지 않고, 주로 투자 원칙과 투자 태도를 다루고 있다. 또한 투자자를 방어적 투자자와 공격적 투자자로 나누어 어떻게 투자를 해야 하는지 투자자의 성향과 기질에 맞는 투자 원칙을 설명하고 있다.",국내도서>경제경영>재테크/투자>주식/펀드,https://image.aladin.co.kr/product/24075/29/coversum/8957821309_1.jpg
9791172448561,2025 해커스 증권투자권유대행인 한권합격 핵심개념 + 적중문제 - 실전모의고사 2회분 | 이론정리+문제풀이 무료 특강 | 핵심 정리부터 실전까지 10일 완성 | 하루 10분 개념완성 자료집 | 무료 바로 채점 및 성적 분석 서비스,"민영기, 송영욱 (엮은이)",2025-04-08,증권투자권유대행인 자격증을 대비할 수 있는 수험서다. 2025 주관처 기본서 개정사항 및 최근 출제경향을 반영하였다. 핵심개념 정리부터 문제풀이까지 한 권으로 완성할 수 있다. 증권투자권유대행인 학습 효과를 높이는 다양한 학습 콘텐츠를 제공한다.,국내도서>수험서/자격증>민간자격>증권투자권유자문인력/증권투자권유대행인,https://image.aladin.co.kr/product/36173/84/coversum/k702038291_1.jpg
9791198207777,손실 없는 투자원칙 - 대한민국 최상위 슈퍼개미의 저점매수 고점매도,남석관 (지은이),2023-10-30,"전업투자 기간 23년을 포함하여 무려 37년간 주식투자를 해온 대한민국 전업투자자의 전설, 최상위 슈퍼개미 남석관 저자의 세 번째 책이다. 전편 《평생 부자로 사는 주식투자》가 주식투자 마인드를 잡아주는 데 중점을 두었다면, 신간 《손실 없는 투자원칙》은 주식시장에서 손실을 최소화하고 수익을 내는 방법, 저자의 주식투자 노하우에 초점을 맞추어 집필했다.",국내도서>경제경영>재테크/투자>재테크/투자 일반,https://image.aladin.co.kr/product/32736/15/coversum/k992936075_1.jpg
