﻿book_id,title,author,pub_date,description,category,cover
9791160450354,2025 건축법규 (학생용) - 개정신판,"최찬환, 김문일, 최기원 (지은이)",2025-02-26,건축법규를 쉽게 이해하고 적용할 수 있도록 관계법령의 내용을 대학 건축 관련학과의 한 학기 건축법규 학습 교재로 활용하도록 체계화하여 정리하였다. 각 장마다 과제하기와 최근 출제된 국가기술자격시험 문제를 유형별로 정리하여 본문 내용학습과 문제에 반영하였다.,국내도서>대학교재/전문서적>공학계열>건축공학>건축사/건축일반,https://image.aladin.co.kr/product/35835/52/coversum/k962037860_1.jpg
9791130640600,대한민국 재건축 재개발 지도 - 되는 곳만 골라 발 빠르게 투자하는,정지영 (지은이),2021-08-25,재건축·재개발 투자의 불확실성을 제거해 ‘되는 곳’만 골라 ‘발 빠르게’ 투자하는 저자의 핵심 노하우가 아낌없이 담겨 있다. 이는 오랜 시간 현장을 발로 뛰어본 사람만이 알 수 있는 살아 있는 정보다. 사업의 속도를 늦추는 요인을 파악하고 이를 사전에 솎아낼 수 있다면 당신도 입주까지 빠르게 진행될 물건을 직접 고르고 분석하는 안목을 갖게 될 것이다.,국내도서>경제경영>재테크/투자>부동산/경매,https://image.aladin.co.kr/product/27840/57/coversum/k552734889_1.jpg
9791193858141,2025 나합격 전산응용건축제도기능사 필기 + 무료특강 - 동영상강의 무료제공｜시험에 자주 출제되는 빈출문제 200선 수록｜핵심요약 합격족보 수록,김수진 (지은이),2025-01-05,"전산응용건축제도기능사 필기를 대비할 수 있는 수험서다. 스터디 플래너로 시험 계획을 세우고, 쏙쏙 들어오는 이론구성으로 개념을 완성할 수 있다. 기출문제 풀기 전 / 시험장 가기 전 ‘후다닥 합격족보’로 최종마무리하고 기출&CBT복원문제 풀이로 실력을 UP시킬 수 있다.",국내도서>수험서/자격증>국가기술자격>건축>전산응용건축제도기능사,https://image.aladin.co.kr/product/34539/86/coversum/k242932653_1.jpg
9791192810607,마스터 건축전기설비 기술사 - 개정판,"봉우근, 김철한, 이태원, 백중길, 황민욱 (지은이)",2025-02-25,"저자가 이 책을 집필하게 된 계기는 국내에 출간된 다수의 수험서가 기출문제 풀이에 편중되거나 합격자의 서브노트로써, 출제기준에서 요구하는 건축전기설비와 관련된 실무경험, 일반지식, 전문지식 및 응용능력을 제고하는데 한계가 있고, 2021년부터 시행된 한국전기설비규정(KEC)은 IEC 국제표준을 도입한 것으로 이를 반영한 건축전기설비기술사 수험서를 만들기 위해서이다.",국내도서>수험서/자격증>국가기술자격>전기>건축전기설비기술사,https://image.aladin.co.kr/product/35774/39/coversum/k412036845_1.jpg
9788952649799,2025 안남식 건축구조(학) 실전 동형모의고사 (12회),안남식 (지은이),2025-02-10,"출제, 선정위원 출신의 경험으로 출제한 총12회 실전문제를 제공한다. 최신 출제경향과 개정 법령을 꼼꼼히 반영하였고, 핵심을 짚은 간결하면서도 상세한 해설로 필수이론을 재정리하였다.",국내도서>수험서/자격증>공무원 수험서>7/9급 공무원>직군별 문제집>건축직,https://image.aladin.co.kr/product/35569/96/coversum/8952649796_1.jpg
9788952650009,2025 안남식 건축계획(학) 핵심 기출지문 빵꾸노트,안남식 (지은이),2025-02-25,단원별ㆍ테마별로 핵심 지문들을 비교적 세부적으로 정리하였고 기본서와 기출문제집을 통해 습득한 이론과 문제의 응용력을 기르는 데 초점을 맞춰 제작되었다.,국내도서>수험서/자격증>공무원 수험서>7/9급 공무원>직군별 문제집>건축직,https://image.aladin.co.kr/product/35794/77/coversum/895265000x_1.jpg
9791193772034,2025 미듬 건축기사 실기 1·2,"임근재, 김진우 (지은이)",2025-02-20,오랫동안 학생들을 가르쳐 온 강의 경험과 현장에서의 실무 경력을 바탕으로 최근의 흐름을 정확히 분석하여 효율적인 시험 준비를 위한 최적의 교재를 목표로 기획된 책이다.,국내도서>수험서/자격증>국가기술자격>건축>건축/산업기사,https://image.aladin.co.kr/product/35774/73/coversum/k502036846_1.jpg
9791194504276,건축설계 입문자를 위한 건축계획 Handbook,이승재 (지은이),2025-02-25,"건축계획과 관련한 전반적인 과정, 즉 주어진 조건들로부터 계획 가능한 프로그램과 규모를 검토하고 설계 단계로의 이행을 위한 기본 대안을 도출하기까지의 과정을 다루고 있다. 따라서 기존의 시설(용도)별 접근방식에서 벗어나 건축관련 법규, 계획관련 치수, 계획 방법론 등을 중심으로 실습을 통하여 실제 프로젝트에 적용할 수 있는 능력을 기르는 데 도움이 될 것이다.",국내도서>대학교재/전문서적>공학계열>건축공학>건축설계,https://image.aladin.co.kr/product/35947/47/coversum/k092037707_1.jpg
9788972975625,건축학교에서 배운 101가지,"매튜 프레더릭 (지은이), 장택수 (엮은이)",2008-03-10,이제 막 건축을 배우는 학생과 이미 숙련된 건축가 모두가 이용할 수 있는 건축설계핸드북이다. '제도하는 법'과 같은 기초부터 복잡한 색이론까지 설계과정에서 짚어보아야 할 건축의 핵심 요소들을 정리했다. 총 101개 항목은 간결한 설명과 그림으로 이루어져 있다.,국내도서>예술/대중문화>건축>건축이야기/건축가,https://image.aladin.co.kr/product/191/32/coversum/8972975621_1.jpg
9791166546037,"2025 10개년 핵심 건축설비기사 과년도 문제해설 - 개정 11판, 기출문제+출제경향분석 3개월 무료동영상, CBT모의고사 무료제공",남재호 (지은이),2025-02-04,"건축설비기사 시험과목인 건축일반, 위생설비, 공기조화설비, 소방 및 전기설비, 건축설비관계법규 등의 광범위한 내용을 보다 체계적으로 정리하여 건축설비 기사시험에 대비한 지침서로서 수험생들이 빠른 시간 안에 자격증 취득을 할 수 있도록 하였다.",국내도서>수험서/자격증>국가기술자격>건축>건축설비/산업기사,https://image.aladin.co.kr/product/35439/87/coversum/k732035932_1.jpg
9791167843487,재개발 재건축 권리와 세금 뽀개기 - 2025 개정판,"김예림, 안수남, 최왕규, 장보원 (지은이)",2025-03-05,"조합원 입장에서 재개발 재건축 권리와 세금에 관한 모든 얘기를 풀어주는 책이다. 재개발 재건축 투자 유형별 입주권 받는 사례를 수록하였고, 재개발 재건축 투자 전후 권리에 관한 유의사항과 재개발 재건축 투자 유형별 세금계산 사례를 총망라했다.",국내도서>경제경영>재테크/투자>부동산/경매,https://image.aladin.co.kr/product/35938/91/coversum/k942037705_1.jpg
9791187011590,데미안 (오리지널 초판본 표지디자인) - 최신 원전 완역본,"헤르만 헤세 (지은이), 이미영 (옮긴이), 김선형 (해설)",2017-01-01,헤르만 헤세의 ‘영혼의 전기’로 소개되는 《데미안》은 깊이 있는 정신분석과 자기 탐구로 가시밭 같은 자아 성찰의 길을 섬세하게 그려낸 그의 대표작이다. 이 책을 1919년 오리지널 초판본의 우아한 표지로 다시 만나보자.,국내도서>소설/시/희곡>독일소설,https://image.aladin.co.kr/product/9871/8/coversum/k042535550_2.jpg
9791169213349,맛있는 디자인 포토샵 & 일러스트레이터 CC 2025 - 누구나 쉽게 배워 제대로 써먹는 그래픽 입문서,"빨간고래(박정아), 윤이사라(포완카) (지은이)",2025-02-11,"그래픽 디자인에 꼭 필요한 포토샵과 일러스트레이터를 한번에, 그리고 가볍게 배울 수 있다. 핵심만 골라 담아 부담 없이 학습할 수 있으며, 따로따로 배우는 것보다 두 가지 프로그램을 더욱 효과적으로 익힐 수 있다.",국내도서>컴퓨터/모바일>그래픽/멀티미디어>포토샵,https://image.aladin.co.kr/product/35713/3/coversum/k742036221_1.jpg
9791187011606,수레바퀴 아래서 (오리지널 초판본 표지디자인) - 최신 원전 완역본,"헤르만 헤세 (지은이), 박지희 (옮긴이), 김선형 (해설)",2017-01-01,성적 위주의 교육 속에서 경쟁에 지쳐 자신을 잃어버린 모든 이들에게 공감과 위로를 전하는 &lt;수레바퀴 아래서&gt;는 헤르만 헤세 자신의 청소년기를 반영한 자전적 소설이다. 이제 &lt;수레바퀴 아래서&gt;를 1906년 오리지널 초판본 표지로 만나 보자.,국내도서>소설/시/희곡>독일소설,https://image.aladin.co.kr/product/9870/83/coversum/k822535559_2.jpg
9791190669238,1984 (오리지널 초판본 표지 디자인),"조지 오웰 (지은이), 박유진 (옮긴이), 박경서 (해설)",2020-06-30,"조지 오웰이 남긴 마지막 정치소설. 1984년 핵전쟁 이후의 오세아니아라는 가상의 전체주의 사회를 설정하여 언어를 제한해 개인의 사고를 통제하고, 과거의 기록을 끊임없이 수정하며, 세뇌와 억압을 통해 거짓을 진실이라 강요하는 암울한 디스토피아를 치밀한 필치로 그려냈다.",국내도서>소설/시/희곡>영미소설,https://image.aladin.co.kr/product/24555/31/coversum/s642937439_1.jpg
9791169213356,"맛있는 디자인 프리미어 프로 & 애프터 이펙트 CC 2025 - 한 권으로 배우는 동영상 편집, 모션 그래픽 입문서","심수진, 윤성우, 이수정 (지은이)",2025-02-24,"영상 편집과 그래픽 디자인에 꼭 필요한 프리미어 프로와 애프터 이펙트를 한번에, 그리고 가볍게 배울 수 있다. 핵심만 골라 담아 부담 없이 학습할 수 있으며, 따로따로 배우는 것보다 두 가지 프로그램을 더욱 효과적으로 익힐 수 있다. 최신 버전인 CC 2025에 완벽히 대응하여 신기능을 빠르게 익힐 수 있도록 도와주며, 기능을 익히는 데 최적화된 실무 예제로 기초&핵심 기능을 더욱 쉽게 학습할 수 있다.",국내도서>컴퓨터/모바일>그래픽/멀티미디어>프리미어/베가스,https://image.aladin.co.kr/product/35810/62/coversum/k322036652_1.jpg
9791190669221,동물농장 (오리지널 초판본 표지 디자인),"조지 오웰 (지은이), 이수정 (옮긴이), 박경서 (해설)",2020-06-30,정치적 글쓰기를 지향했던 영국의 작가이자 정치 평론가 조지 오웰의 대표작인 《동물농장》은 러시아혁명 후 스탈린의 배신과 독재를 우화적으로 그려낸 정치 풍자소설이다. 농장 동물들이 인간들을 몰아내고 스스로 세운 ‘동물농장’에 부패한 독재자가 등장하면서 혁명의 이상은 변질되고 만다는 내용을 골자로 하고 있다.,국내도서>소설/시/희곡>영미소설,https://image.aladin.co.kr/product/24555/26/coversum/k552631970_3.jpg
9791193296844,에르디아 비경쟁토론 수업을 디자인하다 - 공감하고 소통하고 질문하는,에르디아 대화학교(주) (지은이),2025-03-30,‘따뜻한 대화가 만들어낸 소통과 공감’이라는 에르디아의 가치를 청소년에게 전파하고 있는 15명의 저자가 오랜 시간 현장에서 켜켜이 쌓아온 경험과 노하우를 정성껏 담아냈다. 수업을 단계별로 디자인하고 진행하는 방법을 자세히 담고 있어 토론 현장의 생동감 또한 생생하게 느낄 수 있다.,국내도서>좋은부모>교육/학습>학교/학습법,https://image.aladin.co.kr/product/36074/88/coversum/k992037245_1.jpg
9791194280958,초판본 하늘과 바람과 별과 시 : 1955년 정음사 오리지널 초판본 표지 디자인 (반양장),윤동주 (지은이),2024-12-15,"윤동주는 식민 통치의 암울한 현실 속에서도 민족에 대한 사랑과 독립에 대한 간절한 소망을 서정적인 시어에 담은 민족시인이다. 윤동주의 시집 《하늘과 바람과 별과 시》에 수록된 작품들은 윤동주의 뿌리 깊은 고향상실 의식과, 어둠으로 나타난 죽음에의 강박관념 및 이 모두를 총괄하는 실존적인 결단의 의지를 잘 드러내고 있다.",국내도서>소설/시/희곡>시>한국시,https://image.aladin.co.kr/product/35363/48/coversum/k972035997_1.jpg
9791140714063,"디자인 구구단 - 디자인이 필요한 순간, '툭' 튀어나오는 디자인 공식",에이핫 (지은이),2024-08-05,"총 9개의 이론(비율, 공간, 균형, 색의 속성, 질감, 형과 형태, 움직임, 율동, 서체)을 통해 디자인이 필요한 모든 분이 디자인에 대한 이해를 높이고 감각을 키울 수 있도록 안내한다. 12년간 실무에서 감각을 키우고 3년간 직접 교육을 하면서 누구나 쉽게 감각을 키울 수 있는 방법을 연구해 만든 트레이닝 북이다.",국내도서>컴퓨터/모바일>그래픽/멀티미디어>그래픽 일반,https://image.aladin.co.kr/product/34360/88/coversum/k182932901_1.jpg
9791198815026,2026 미술ㆍ디자인ㆍ만화애니 진학상담 가이드북,미대입시사 편집부 (지은이),2025-03-04,,국내도서>고등학교참고서>논술/면접/수시>입시자료집,https://image.aladin.co.kr/product/35978/22/coversum/k782037903_1.jpg
9791190669603,인간 실격 (오리지널 초판본 표지 디자인),"다자이 오사무 (지은이), 장하나 (옮긴이)",2022-01-03,"누구보다 세상과 인간을 동경했으나 나약함과 순수함으로 인해 세상에서 버려지고 인간으로서의 자격마저 잃은 채 파멸되어가는 인물을 그려내며, 전 세계 독자들에게 많은 사랑을 받았던 다자이 오사무의 대표작.",국내도서>소설/시/희곡>일본소설>1950년대 이전 일본소설,https://image.aladin.co.kr/product/33585/15/coversum/k282939597_2.jpg
9791193217818,디자인을 위한 가장 완벽한 배색 가이드 - 테마별 1080가지 팬톤 색 조합 팔레트,"리트리스 아이즈먼 (지은이), 이소윤 (옮긴이)",2025-02-12,"디자이너들의 영원한 숙제인 조화로운 배색 작업을 돕기 위해 팬톤 컬러 연구소에서 탄생한 필독서다. 30가지 컬러 무드에 따른 1080가지 팬톤 컬러 조합 팔레트와 기본적인 컬러 디자인 이론, 그리고 실제 현장에서 바로 적용할 수 있는 각종 배색 팁을 통해 복잡하게만 느껴졌던 컬러의 세계에서 원하는 메시지와 분위기를 정확히 전달할 수 있도록 돕는다.",국내도서>예술/대중문화>미술>미술비평/이론,https://image.aladin.co.kr/product/35711/78/coversum/k782036127_1.jpg
9791198673060,"디자인 감각 제대로 키우는 법 - 아이디어 발상, 레이아웃 요령까지 부족한 감각을 채워주는 모두를 위한 디자인 기본 원칙","가마타 다카시 (지은이), 김현미 (옮긴이)",2025-05-12,"‘나는 감각이 없어…’라며 주눅 들어 본 적 있는 사람을 위한 디자인 교양서다. 디자인을 전공하지 않았거나 이제 막 실무에 발을 들인 신입 디자이너, 디자인이 주업이 아니지만 디자인을 해야 하는 마케터나 기획자까지 ‘감각’을 키우고 싶은 사람이 체계적으로 감각을 기를 수 있도록 돕는다.",국내도서>예술/대중문화>디자인/공예>디자인이론/비평/역사,https://image.aladin.co.kr/product/36276/69/coversum/k692038836_1.jpg
9791168230934,디자인의 유령들,오창섭 (지은이),2025-04-11,"디자인역사문화 연구자 오창섭이 오늘날 한국 디자인의 ‘유령들’에 응답해 2000년대 역사적 사건의 파편을 이야기함으로써 현재의 시공간에 재구성해 낸 디자인 비평서다. 이 책에서 유령은 “어른거리는 사건들, 뭐라고 명명하기 어려운 사건들”이다. 디자인 문화, 공공 디자인, 작가주의 디자인은 그런 유령의 방식으로 존재하며 각각 다른 유령성의 존재 양식을 보여주었다.",국내도서>예술/대중문화>디자인/공예>디자인이야기/디자이너/디자인 실기,https://image.aladin.co.kr/product/36277/1/coversum/k532038837_1.jpg
9788927457602,2025 시각디자인 산업기사 필기 (시각디자인기사 겸용) - 전3권 - 무료 동영상 강의가 있는,조영우 (지은이),2025-03-10,자주 출제되는 주요 내용을 바탕으로 자격시험은 물론 실무에서도 꼭 알아야 할 내용을 정리하였다. 해당 내용에 출제연도를 표기해 출제경향을 한눈에 파악하고 총 15강으로 나누어 효율적인 학습을 진행할 수 있도록 하였다. 또한 한 과목이 끝나면 ‘연습문제’를 통해 학습 정도를 스스로 평가·점검할 수 있도록 하였다.,국내도서>수험서/자격증>국가기술자격>디자인>시각디자인/산업기사,https://image.aladin.co.kr/product/35871/91/coversum/8927457609_1.jpg
9791194280828,초판본 싯다르타 - 1922년 오리지널 초판본 표지디자인,"헤르만 헤세 (지은이), 박진권 (옮긴이)",2025-02-28,"20세기 독일 문학가들 가운데 우리나라 독자들에게 가장 잘 알려진 작가를 꼽으라고 한다면 단연 헤르만 헤세일 것이다. 내면의 탐구자이자 자아 성찰의 대표 작가인 헤르만 헤세는 휴머니즘을 지향하며, 고뇌하는 청춘과 자연에 대한 동경, 인간의 양면성 등을 작품에 담았다.",국내도서>소설/시/희곡>독일소설,https://image.aladin.co.kr/product/35803/15/coversum/k862036559_1.jpg
9788970593029,디자인의 디자인,"하라 켄야 (지은이), 민병걸 (옮긴이)",2007-02-27,"일본의 그래픽 디자이너 하라 켄야가 '리디자인(Re-design)' 전시, '무인양품(無印良品)', '마츠야 긴자' 리뉴얼, '나가노 동계 올림픽' 개회식 프로그램, '아이치 만국 박람회' 프로모션, '세계 그래픽 디자인 회의' 등 자신이 관여한 여러 프로젝트를 돌아보며 '디자인이란 무엇인가?'에 대한 나름의 답을 풀어놓는다.",국내도서>예술/대중문화>디자인/공예>디자인이론/비평/역사,https://image.aladin.co.kr/product/89/22/coversum/8970593020_2.jpg
9791194591610,초판본 오만과 편견 - 1894년 오리지널 초판본 표지디자인,"제인 오스틴 (지은이), 김유미 (옮긴이)",2025-03-31,"인류의 보편적인 감성을 따르면서도 그 안에 갇히지 않았고, 소설의 묘미를 살리면서 통속적이지 않기에 사람들의 마음을 움직였고, 첫 문장부터 읽는 이를 이야기 속으로 끌어당긴다. 1894년 초판본 표지를 통해 제인 오스틴의 문학적인 감성을 직접 느껴보자.",국내도서>소설/시/희곡>영미소설,https://image.aladin.co.kr/product/36069/68/coversum/k562037144_1.jpg
9791194280798,초판본 노인과 바다 - 1952년 오리지널 초판본 표지디자인,"어니스트 헤밍웨이 (지은이), 이수정 (옮긴이)",2025-02-28,소설 《노인과 바다》는 1·2차 세계대전을 겪으며 독보적인 서사 기법을 구사했던 어니스트 헤밍웨이가 생애 마지막으로 남긴 불멸의 고전이다. 작가 고유의 서사 기법과 실존 철학이 집약돼 있어서 ‘헤밍웨이 문학의 정점’으로 꼽히는 작품이기도 하다. 헤밍웨이는 《노인과 바다》를 통해 잔인한 현실에 대한 성숙하고 균형 잡힌 통찰력으로 치열한 삶을 사는 불굴의 인간상을 조명한다.,국내도서>소설/시/희곡>영미소설,https://image.aladin.co.kr/product/35803/19/coversum/k952036550_1.jpg
9791169912174,2025 택틱 디자인보호법 Tactic Design Law - 제6판,정다운 (지은이),2025-03-19,,국내도서>수험서/자격증>국가전문자격>변리사,https://image.aladin.co.kr/product/36093/49/coversum/k622038862_2.jpg
9791194755159,"관점을 디자인하라 (표지 3종 중 1종 랜덤) - 없는 것인가, 못 본 것인가? (50만 부 개정증보판: ABC Edition)",박용후 (지은이),2025-05-02,"출간 10주년을 맞아 새로이 펴낸 개정증보판 ‘ABC Edition’은 ‘Above, Beyond, Cross’라는 3개 단어를 통해 새로운 관점으로 한 단계 도약할 것을 촉구하는 저자의 간절한 마음을 담은 것이다. 또한 검정, 보라, 초록, 3가지 버전 표지를 동시에 선보여 또 한 번 고정관념의 틀에서 벗어난 신선한 즐거움을 선사한다.",국내도서>자기계발>성공>성공학,https://image.aladin.co.kr/product/36277/60/coversum/k192038939_1.jpg
9791169213585,맛있는 디자인 포토샵 CC 2025 - 핵심 기능을 담은 기본편+실무 예제가 풍부한 활용편,"윤이사라(포완카), 김신애 (지은이)",2025-03-24,"그래픽 디자인의 기본인 포토샵의 기초부터 활용까지 제대로 배울 수 있도록 구성했다. 포토샵의 기본&핵심 기능을 꼼꼼하게 설명하여 기초부터 탄탄하게 학습할 수 있으며, 다양한 실무 예제 실습을 구성하여 디자인 실무를 효과적으로 익힐 수 있다. 가장 최신 버전인 CC 2025에 완벽히 대응하여 포토샵을 좀 더 효율적이고 빠르게 학습할 수도 있다.",국내도서>컴퓨터/모바일>그래픽/멀티미디어>포토샵,https://image.aladin.co.kr/product/36080/50/coversum/k792037349_1.jpg
9791194280804,초판본 변신 - 1916년 오리지널 초판본 표지디자인,"프란츠 카프카 (지은이), 한영란 (옮긴이)",2025-02-28,세상에서 소외되어 버림받은 인간을 탐구하는 카프카의 《변신》이 더스토리 1916년 오리지널 초판본 표지디자인으로 새롭게 출간되었다. 이 책에 실린 9편의 작품들에는 평생 아버지와 대립을 겪으며 작가의 길과 생활인의 길에서 방황한 카프카 자신의 고뇌가 녹아 있다.,국내도서>소설/시/희곡>독일소설,https://image.aladin.co.kr/product/35803/7/coversum/k582036559_1.jpg
9788970414430,"디자인 Design 2025.5 - 디자인의 또 다른 번역가, 포토그래퍼",디자인 편집부 (지은이),2025-04-21,,국내도서>잡지>대중문화/예술,https://image.aladin.co.kr/product/36276/44/coversum/8970414436_1.jpg
9791169213592,맛있는 디자인 일러스트레이터 CC 2025 - 핵심 기능을 담은 기본편 + 실무 예제가 풍부한 활용편,빨간고래(박정아) (지은이),2025-03-31,"그래픽 디자인에 꼭 필요한 일러스트레이터의 기초부터 활용법까지 제대로 배울 수 있다. 일러스트레이터의 기본&핵심 기능을 꼼꼼하게 설명하여 기본기부터 탄탄하게 다질 수 있으며, 다양한 실무 예제를 수록하여 주요 기능의 활용법을 효과적으로 익힐 수 있다.",국내도서>컴퓨터/모바일>웹디자인/홈페이지>일러스트레이터,https://image.aladin.co.kr/product/36114/2/coversum/k472038063_1.jpg
9791194280781,초판본 이방인 - 1944년 오리지널 초판본 표지디자인,"알베르 카뮈 (지은이), 최헵시바 (옮긴이)",2025-02-18,"《이방인》은 알베르 카뮈가 구상한 부조리극의 삼부작 중 하나이자 그가 쓴 최초의 소설이다. 1942년 5월 말, 출간 당시부터 문학적 ‘사건’으로 취급될 정도로 엄청난 호평을 받았으며 제2차 세계대전 이후 최대의 걸작이라는 극찬을 받았다.",국내도서>소설/시/희곡>프랑스소설,https://image.aladin.co.kr/product/35803/20/coversum/k992036550_1.jpg
9788970414423,"디자인 Design 2025.4 - 광야에서 우주까지, 엔터테인먼트 디자인 프런티어",디자인 편집부 (지은이),2025-03-21,,국내도서>잡지>대중문화/예술,https://image.aladin.co.kr/product/36100/4/coversum/8970414428_1.jpg
9791165346010,언어를 디자인하라,"유영만, 박용후 (지은이)",2022-08-31,어떻게 해야 언어를 레벨업할 수 있을까? 이 문제를 놓고 관점 디자인의 대가 박용후 대표와 언어의 연금술사 유영만 교수가 의기투합했다. 대한민국 최고 전문가 두 사람이 우리 시대 언어의 위기를 진단하고 해법을 찾아 토론했다.,국내도서>자기계발>협상/설득/화술>화술,https://image.aladin.co.kr/product/29944/23/coversum/k012838637_1.jpg
9791194591429,초판본 젊은 베르테르의 슬픔 - 1774년 오리지널 초판본 표지 디자인,"요한 볼프강 폰 괴테 (지은이), 허승진 (옮긴이)",2025-03-28,"“나는 체험하지 않은 것은 한 줄도 쓰지 않았다. 그러나 단 한 줄의 문장도 체험한 것 그대로 쓰지는 않았다”는 말처럼, 주인공 베르테르는 괴테 자신이자, 우리 ‘상처받기 쉬운 영혼’들의 초상화와도 같다. 사랑과 도덕, 광기와 이성, 행복과 불행, 삶과 죽음 사이에서 고뇌하는 베르테르에게 우리가 공감하는 이유다.",국내도서>소설/시/희곡>독일소설,https://image.aladin.co.kr/product/35989/17/coversum/k582037513_2.jpg
